keyword,title,subreddit,timestamp,post_url,scrape_date,batch_number,source,clean_title,skills_list,skill,role,location
aws engineer india,"[FOR HIRE] Senior Data Engineer | Python, Spark, Databricks, AWS, ML, LLMs – Remote/Freelance | Bengaluru, India",r/Indiajobs,2026-06-17T10:07:02+00:00,https://old.reddit.com/r/Indiajobs/comments/1u8611o/for_hire_senior_data_engineer_python_spark/,2026-07-01,1.0,reddit,for hire senior data engineer python spark databricks aws ml llms remotefreelance bengaluru india,"['Artificial Intelligence', 'Cloud', 'Machine Learning', 'Python']",Python,Unknown,"Bangalore, Remote"
android developer india,Need advice: Moving to Dubai from India for tech job (Flutter/Android dev),r/dubai,2026-04-07T10:03:06+00:00,https://old.reddit.com/r/dubai/comments/1sernv2/need_advice_moving_to_dubai_from_india_for_tech/,2026-07-01,1.0,reddit,need advice moving to dubai from india for tech job flutterandroid dev,['Artificial Intelligence'],Artificial Intelligence,Unknown,Unknown
android developer india,Android 17 Beta 4 is available in india if anyone tried yet pls tell us about software changes.,r/IQOO13,2026-06-26T17:53:11+00:00,https://old.reddit.com/r/IQOO13/comments/1ugdxsl/android_17_beta_4_is_available_in_india_if_anyone/,2026-07-01,1.0,reddit,android 17 beta 4 is available in india if anyone tried yet pls tell us about software changes,['Artificial Intelligence'],Artificial Intelligence,Unknown,Unknown
ios developer india,I have joined iOS 27 Siri waiting list ? Anyone getting this in developer beta ?,r/ios26beta,2026-06-09T17:41:03+00:00,https://old.reddit.com/r/ios26beta/comments/1u1c4ed/i_have_joined_ios_27_siri_waiting_list_anyone/,2026-07-01,1.0,reddit,i have joined ios 27 siri waiting list anyone getting this in developer beta,['Artificial Intelligence'],Artificial Intelligence,Software Engineer,Unknown
ios developer india,Welcome Indian Citizens to India of WarEra.io,r/Indiangamers,2026-01-24T12:07:40+00:00,https://old.reddit.com/r/Indiangamers/comments/1qllcp0/welcome_indian_citizens_to_india_of_wareraio/,2026-07-01,1.0,reddit,welcome indian citizens to india of wareraio,['Artificial Intelligence'],Artificial Intelligence,Unknown,Unknown
ios developer india,"Full Stack Developer (MERN) | Looking for Junior/Fresher Role | Mumbai, India",r/javascriptjobs,2026-06-10T20:29:12+00:00,https://old.reddit.com/r/javascriptjobs/comments/1u2dxwp/full_stack_developer_mern_looking_for/,2026-07-01,1.0,reddit,full stack developer mern looking for juniorfresher role mumbai india,['Artificial Intelligence'],Artificial Intelligence,Software Engineer,Mumbai
data analyst india,Anyone working as a Generative AI Data Analyst at Welocalize India?,r/Welocalize,2026-06-18T16:42:20+00:00,https://old.reddit.com/r/Welocalize/comments/1u9bdbm/anyone_working_as_a_generative_ai_data_analyst_at/,2026-07-01,1.0,reddit,anyone working as a generative ai data analyst at welocalize india,['Artificial Intelligence'],Artificial Intelligence,Data Analyst,Unknown
data analyst india,Is it really true that Data Scientist/Analyst jobs are saturated in India?,r/developersIndia,2025-06-07T10:23:36+00:00,https://old.reddit.com/r/developersIndia/comments/1l5hmmc/is_it_really_true_that_data_scientistanalyst_jobs/,2026-07-01,1.0,reddit,is it really true that data scientistanalyst jobs are saturated in india,['Data Science'],Data Science,Data Scientist,Unknown
data analyst india,"Am I underpaid? 1 YOE Data Analyst (AWS, Python, SQL) – Resume Review",r/developersIndia,2026-04-19T04:05:14+00:00,https://old.reddit.com/r/developersIndia/comments/1spiiw9/am_i_underpaid_1_yoe_data_analyst_aws_python_sql/,2026-07-01,1.0,reddit,am i underpaid 1 yoe data analyst aws python sql resume review,"['Artificial Intelligence', 'Cloud', 'Python', 'SQL']",Artificial Intelligence,Data Analyst,Unknown
data analyst india,"Am I underpaid? 1 YOE Data Analyst (AWS, Python, SQL) – Resume Review",r/developersIndia,2026-04-19T04:05:14+00:00,https://old.reddit.com/r/developersIndia/comments/1spiiw9/am_i_underpaid_1_yoe_data_analyst_aws_python_sql/,2026-07-01,1.0,reddit,am i underpaid 1 yoe data analyst aws python sql resume review,"['Artificial Intelligence', 'Cloud', 'Python', 'SQL']",Cloud,Data Analyst,Unknown
data analyst india,"Am I underpaid? 1 YOE Data Analyst (AWS, Python, SQL) – Resume Review",r/developersIndia,2026-04-19T04:05:14+00:00,https://old.reddit.com/r/developersIndia/comments/1spiiw9/am_i_underpaid_1_yoe_data_analyst_aws_python_sql/,2026-07-01,1.0,reddit,am i underpaid 1 yoe data analyst aws python sql resume review,"['Artificial Intelligence', 'Cloud', 'Python', 'SQL']",Python,Data Analyst,Unknown
data analyst india,"Am I underpaid? 1 YOE Data Analyst (AWS, Python, SQL) – Resume Review",r/developersIndia,2026-04-19T04:05:14+00:00,https://old.reddit.com/r/developersIndia/comments/1spiiw9/am_i_underpaid_1_yoe_data_analyst_aws_python_sql/,2026-07-01,1.0,reddit,am i underpaid 1 yoe data analyst aws python sql resume review,"['Artificial Intelligence', 'Cloud', 'Python', 'SQL']",SQL,Data Analyst,Unknown
business analyst india,Boeing shares fall 8% after Air India plane crashes,r/stocks,2025-06-12T10:55:28+00:00,https://old.reddit.com/r/stocks/comments/1l9jhex/boeing_shares_fall_8_after_air_india_plane_crashes/,2026-07-01,1.0,reddit,boeing shares fall 8 after air india plane crashes,['Artificial Intelligence'],Artificial Intelligence,Unknown,Unknown
business analyst india,'33% of your salary is being paid off to EMIs': Analyst says debt is crushing middle class India - BusinessToday,r/india,2025-07-03T12:37:42+00:00,https://old.reddit.com/r/india/comments/1lqoi8j/33_of_your_salary_is_being_paid_off_to_emis/,2026-07-01,1.0,reddit,33 of your salary is being paid off to emis analyst says debt is crushing middle class india businesstoday,['Artificial Intelligence'],Artificial Intelligence,Unknown,Unknown
business analyst india,"Financial Analyst from India (Telugu Preferred) to Prepare a Detailed Petrol Bunk P&L Statement – ₹5,000",r/IndiaJobsOpenings,2026-06-11T11:40:16+00:00,https://old.reddit.com/r/IndiaJobsOpenings/comments/1u2wmpf/financial_analyst_from_india_telugu_preferred_to/,2026-07-01,1.0,reddit,financial analyst from india telugu preferred to prepare a detailed petrol bunk pl statement 5000,['Artificial Intelligence'],Artificial Intelligence,Unknown,Unknown
data scientist india,Salary range for Data Scientists in India,r/DataScienceJobs,2026-04-06T17:36:42+00:00,https://old.reddit.com/r/DataScienceJobs/comments/1se5obc/salary_range_for_data_scientists_in_india/,2026-07-01,1.0,reddit,salary range for data scientists in india,['Data Science'],Data Science,Data Scientist,Unknown
data scientist india,There are no Data Science jobs in India?,r/DataScienceIndia,2026-02-02T16:49:16+00:00,https://old.reddit.com/r/DataScienceIndia/comments/1qu0cnw/there_are_no_data_science_jobs_in_india/,2026-07-01,1.0,reddit,there are no data science jobs in india,['Data Science'],Data Science,Unknown,Unknown
data scientist india,Abysmal depth of knowledge from people claiming to be AI Engineers and Data Scientists,r/developersIndia,2026-01-09T05:27:16+00:00,https://old.reddit.com/r/developersIndia/comments/1q7zrvc/abysmal_depth_of_knowledge_from_people_claiming/,2026-07-01,1.0,reddit,abysmal depth of knowledge from people claiming to be ai engineers and data scientists,"['Artificial Intelligence', 'Data Science']",Artificial Intelligence,Data Scientist,Unknown
data scientist india,Abysmal depth of knowledge from people claiming to be AI Engineers and Data Scientists,r/developersIndia,2026-01-09T05:27:16+00:00,https://old.reddit.com/r/developersIndia/comments/1q7zrvc/abysmal_depth_of_knowledge_from_people_claiming/,2026-07-01,1.0,reddit,abysmal depth of knowledge from people claiming to be ai engineers and data scientists,"['Artificial Intelligence', 'Data Science']",Data Science,Data Scientist,Unknown
data scientist india,Why is every Indian abroad suddenly a “data scientist”?,r/Indians_StudyAbroad,2025-11-06T17:38:35+00:00,https://old.reddit.com/r/Indians_StudyAbroad/comments/1oq5eus/why_is_every_indian_abroad_suddenly_a_data/,2026-07-01,1.0,reddit,why is every indian abroad suddenly a data scientist,['Data Science'],Data Science,Data Scientist,Unknown
data scientist india,"ANZ bank has 8000 staff in India and CEO said “This is not a sweatshop. These are smart, educated people – data scientists and engineers – and our ability to have 8000 of them, that is what the benefit is: you get scale,” “I imagine more complex work will continue to be built into Bangalore.""",r/AusFinance,2023-06-11T12:47:24+00:00,https://old.reddit.com/r/AusFinance/comments/146t3dm/anz_bank_has_8000_staff_in_india_and_ceo_said/,2026-07-01,1.0,reddit,anz bank has 8000 staff in india and ceo said this is not a sweatshop these are smart educated people data scientists and engineers and our ability to have 8000 of them that is what the benefit is you get scale i imagine more complex work will continue to be built into bangalore,"['Artificial Intelligence', 'Data Science']",Artificial Intelligence,Data Scientist,Bangalore
data scientist india,"ANZ bank has 8000 staff in India and CEO said “This is not a sweatshop. These are smart, educated people – data scientists and engineers – and our ability to have 8000 of them, that is what the benefit is: you get scale,” “I imagine more complex work will continue to be built into Bangalore.""",r/AusFinance,2023-06-11T12:47:24+00:00,https://old.reddit.com/r/AusFinance/comments/146t3dm/anz_bank_has_8000_staff_in_india_and_ceo_said/,2026-07-01,1.0,reddit,anz bank has 8000 staff in india and ceo said this is not a sweatshop these are smart educated people data scientists and engineers and our ability to have 8000 of them that is what the benefit is you get scale i imagine more complex work will continue to be built into bangalore,"['Artificial Intelligence', 'Data Science']",Data Science,Data Scientist,Bangalore
data scientist india,"As a data scientist, Tamil Nadu’s rising debt statistics alarms me — it should alarm you too",r/TamilNadu,2025-11-21T11:35:56+00:00,https://old.reddit.com/r/TamilNadu/comments/1p2wc29/as_a_data_scientist_tamil_nadus_rising_debt/,2026-07-01,1.0,reddit,as a data scientist tamil nadus rising debt statistics alarms me it should alarm you too,['Data Science'],Data Science,Data Scientist,Unknown
data scientist india,2 YOE Data Scientist [Unemployed in data field] Burnt out and feeling helpless.,r/datascience,2025-11-27T09:40:13+00:00,https://old.reddit.com/r/datascience/comments/1p7y708/2_yoe_data_scientist_unemployed_in_data_field/,2026-07-01,1.0,reddit,2 yoe data scientist unemployed in data field burnt out and feeling helpless,['Data Science'],Data Science,Data Scientist,Unknown
data scientist india,"Should I stay in the US and continue my job search, or take a 20 LPA Data Scientist offer in India?",r/backtoindia,2026-06-23T23:19:56+00:00,https://old.reddit.com/r/backtoindia/comments/1udwv3m/should_i_stay_in_the_us_and_continue_my_job/,2026-07-01,1.0,reddit,should i stay in the us and continue my job search or take a 20 lpa data scientist offer in india,['Data Science'],Data Science,Data Scientist,Unknown
data scientist india,62 years old retired govt employee and self taught data scientist. How to find a job in India ?,r/india,2021-03-20T04:04:14+00:00,https://old.reddit.com/r/india/comments/m8z2pm/62_years_old_retired_govt_employee_and_self/,2026-07-01,1.0,reddit,62 years old retired govt employee and self taught data scientist how to find a job in india,['Data Science'],Data Science,Data Scientist,Unknown
data scientist india,22 Year Old - Working in SG vs USA as a Data Scientist,r/askSingapore,2026-05-24T23:33:20+00:00,https://old.reddit.com/r/askSingapore/comments/1tmrunk/22_year_old_working_in_sg_vs_usa_as_a_data/,2026-07-01,1.0,reddit,22 year old working in sg vs usa as a data scientist,['Data Science'],Data Science,Data Scientist,Unknown
data scientist india,Heatwaves aren't considered a disaster In India maybe because there is manupulation in data to set the narrative......(Read the post for discrepencies and researches that claim that the death toll is much much higher than reported),r/CriticalThinkingIndia,2026-06-03T16:59:59+00:00,https://old.reddit.com/r/CriticalThinkingIndia/comments/1tvviio/heatwaves_arent_considered_a_disaster_in_india/,2026-07-01,1.0,reddit,heatwaves arent considered a disaster in india maybe because there is manupulation in data to set the narrativeread the post for discrepencies and researches that claim that the death toll is much much higher than reported,['Artificial Intelligence'],Artificial Intelligence,Unknown,Unknown
data scientist india,I'm a data scientist. I build AI systems. I can explain trauma bonds in clinical detail. And I still can't leave a man who choked me and told me I'm not worth a future. I need to hear from women who actually got out.,r/TwoXChromosomes,2026-06-01T09:22:43+00:00,https://old.reddit.com/r/TwoXChromosomes/comments/1ttmupd/im_a_data_scientist_i_build_ai_systems_i_can/,2026-07-01,1.0,reddit,im a data scientist i build ai systems i can explain trauma bonds in clinical detail and i still cant leave a man who choked me and told me im not worth a future i need to hear from women who actually got out,"['Artificial Intelligence', 'Data Science']",Artificial Intelligence,Data Scientist,Unknown
data scientist india,I'm a data scientist. I build AI systems. I can explain trauma bonds in clinical detail. And I still can't leave a man who choked me and told me I'm not worth a future. I need to hear from women who actually got out.,r/TwoXChromosomes,2026-06-01T09:22:43+00:00,https://old.reddit.com/r/TwoXChromosomes/comments/1ttmupd/im_a_data_scientist_i_build_ai_systems_i_can/,2026-07-01,1.0,reddit,im a data scientist i build ai systems i can explain trauma bonds in clinical detail and i still cant leave a man who choked me and told me im not worth a future i need to hear from women who actually got out,"['Artificial Intelligence', 'Data Science']",Data Science,Data Scientist,Unknown
data scientist india,"As a data scientist, Tamil Nadu’s rising debt statistics alarms me — it should alarm you too",r/Chennai,2025-11-21T11:35:59+00:00,https://old.reddit.com/r/Chennai/comments/1p2wc35/as_a_data_scientist_tamil_nadus_rising_debt/,2026-07-01,1.0,reddit,as a data scientist tamil nadus rising debt statistics alarms me it should alarm you too,['Data Science'],Data Science,Data Scientist,Unknown
data scientist india,"As a data scientist, Tamil Nadu’s rising debt statistics alarms me — it should alarm you too",r/chennaicity,2025-11-21T11:36:03+00:00,https://old.reddit.com/r/chennaicity/comments/1p2wc4t/as_a_data_scientist_tamil_nadus_rising_debt/,2026-07-01,1.0,reddit,as a data scientist tamil nadus rising debt statistics alarms me it should alarm you too,['Data Science'],Data Science,Data Scientist,Unknown
data scientist india,"Moving to Germany as a Data Scientist (4+ YOE, No German Language) – Advice Needed!",r/Germany_Jobs,2026-05-15T10:14:34+00:00,https://old.reddit.com/r/Germany_Jobs/comments/1tdrz8b/moving_to_germany_as_a_data_scientist_4_yoe_no/,2026-07-01,1.0,reddit,moving to germany as a data scientist 4 yoe no german language advice needed,['Data Science'],Data Science,Data Scientist,Unknown
data scientist india,What should a 30 year old laid off Data Scientist do with their life?,r/cscareerquestions,2026-01-02T20:23:54+00:00,https://old.reddit.com/r/cscareerquestions/comments/1q29ixa/what_should_a_30_year_old_laid_off_data_scientist/,2026-07-01,1.0,reddit,what should a 30 year old laid off data scientist do with their life,"['Artificial Intelligence', 'Data Science']",Artificial Intelligence,Data Scientist,Unknown
data scientist india,What should a 30 year old laid off Data Scientist do with their life?,r/cscareerquestions,2026-01-02T20:23:54+00:00,https://old.reddit.com/r/cscareerquestions/comments/1q29ixa/what_should_a_30_year_old_laid_off_data_scientist/,2026-07-01,1.0,reddit,what should a 30 year old laid off data scientist do with their life,"['Artificial Intelligence', 'Data Science']",Data Science,Data Scientist,Unknown
data scientist india,Data Scientist working for FAANG in India; sick and tired of my home country; any advice on career move doing remote work?,r/digitalnomad,2025-12-09T19:12:02+00:00,https://old.reddit.com/r/digitalnomad/comments/1pig8du/data_scientist_working_for_faang_in_india_sick/,2026-07-01,1.0,reddit,data scientist working for faang in india sick and tired of my home country any advice on career move doing remote work,['Data Science'],Data Science,Data Scientist,Remote
machine learning engineer india,Sad state of machine learning in India,r/learnmachinelearning,2026-05-09T07:44:57+00:00,https://old.reddit.com/r/learnmachinelearning/comments/1t7ybs2/sad_state_of_machine_learning_in_india/,2026-07-01,1.0,reddit,sad state of machine learning in india,['Machine Learning'],Machine Learning,Unknown,Unknown
machine learning engineer india,🚀 Sarvam AI Hiring | Machine Learning Engineer (Dubbing) | Bengaluru 🇮🇳🤖,r/ambitionarena7,2026-06-16T18:27:50+00:00,https://old.reddit.com/r/ambitionarena7/comments/1u7ltf5/sarvam_ai_hiring_machine_learning_engineer/,2026-07-01,1.0,reddit,sarvam ai hiring machine learning engineer dubbing bengaluru,"['Artificial Intelligence', 'Machine Learning']",Artificial Intelligence,Machine Learning Engineer,Bangalore
machine learning engineer india,🚀 Sarvam AI Hiring | Machine Learning Engineer (Dubbing) | Bengaluru 🇮🇳🤖,r/ambitionarena7,2026-06-16T18:27:50+00:00,https://old.reddit.com/r/ambitionarena7/comments/1u7ltf5/sarvam_ai_hiring_machine_learning_engineer/,2026-07-01,1.0,reddit,sarvam ai hiring machine learning engineer dubbing bengaluru,"['Artificial Intelligence', 'Machine Learning']",Machine Learning,Machine Learning Engineer,Bangalore
machine learning engineer india,[FOR HIRE] Software Engineer / AI Engineer / Machine Learning Engineer | Remote Worldwide / India | $25–35 USD/hr or Full-Time,r/hiring,2026-06-30T08:11:01+00:00,https://old.reddit.com/r/hiring/comments/1ujj31n/for_hire_software_engineer_ai_engineer_machine/,2026-07-01,1.0,reddit,for hire software engineer ai engineer machine learning engineer remote worldwide india 2535 usdhr or fulltime,"['Artificial Intelligence', 'Machine Learning']",Artificial Intelligence,Software Engineer,Remote
machine learning engineer india,[FOR HIRE] Software Engineer / AI Engineer / Machine Learning Engineer | Remote Worldwide / India | $25–35 USD/hr or Full-Time,r/hiring,2026-06-30T08:11:01+00:00,https://old.reddit.com/r/hiring/comments/1ujj31n/for_hire_software_engineer_ai_engineer_machine/,2026-07-01,1.0,reddit,for hire software engineer ai engineer machine learning engineer remote worldwide india 2535 usdhr or fulltime,"['Artificial Intelligence', 'Machine Learning']",Machine Learning,Software Engineer,Remote
machine learning engineer india,I'm experienced Machine Learning engineer with published paper and exp building AI for startups in India.,r/learnmachinelearning,2025-08-02T10:18:35+00:00,https://old.reddit.com/r/learnmachinelearning/comments/1mfn47h/im_experienced_machine_learning_engineer_with/,2026-07-01,1.0,reddit,im experienced machine learning engineer with published paper and exp building ai for startups in india,"['Artificial Intelligence', 'Machine Learning']",Artificial Intelligence,Machine Learning Engineer,Unknown
machine learning engineer india,I'm experienced Machine Learning engineer with published paper and exp building AI for startups in India.,r/learnmachinelearning,2025-08-02T10:18:35+00:00,https://old.reddit.com/r/learnmachinelearning/comments/1mfn47h/im_experienced_machine_learning_engineer_with/,2026-07-01,1.0,reddit,im experienced machine learning engineer with published paper and exp building ai for startups in india,"['Artificial Intelligence', 'Machine Learning']",Machine Learning,Machine Learning Engineer,Unknown
machine learning engineer india,More than 10% AI solutions and machine learning engineer jobs in India waiting to be filled: Randstad Digital report,r/StartupFuture,2026-06-24T11:01:19+00:00,https://old.reddit.com/r/StartupFuture/comments/1ueacj8/more_than_10_ai_solutions_and_machine_learning/,2026-07-01,1.0,reddit,more than 10 ai solutions and machine learning engineer jobs in india waiting to be filled randstad digital report,"['Artificial Intelligence', 'Git', 'Machine Learning']",Artificial Intelligence,Machine Learning Engineer,Unknown
machine learning engineer india,More than 10% AI solutions and machine learning engineer jobs in India waiting to be filled: Randstad Digital report,r/StartupFuture,2026-06-24T11:01:19+00:00,https://old.reddit.com/r/StartupFuture/comments/1ueacj8/more_than_10_ai_solutions_and_machine_learning/,2026-07-01,1.0,reddit,more than 10 ai solutions and machine learning engineer jobs in india waiting to be filled randstad digital report,"['Artificial Intelligence', 'Git', 'Machine Learning']",Git,Machine Learning Engineer,Unknown
machine learning engineer india,More than 10% AI solutions and machine learning engineer jobs in India waiting to be filled: Randstad Digital report,r/StartupFuture,2026-06-24T11:01:19+00:00,https://old.reddit.com/r/StartupFuture/comments/1ueacj8/more_than_10_ai_solutions_and_machine_learning/,2026-07-01,1.0,reddit,more than 10 ai solutions and machine learning engineer jobs in india waiting to be filled randstad digital report,"['Artificial Intelligence', 'Git', 'Machine Learning']",Machine Learning,Machine Learning Engineer,Unknown
machine learning engineer india,"🚀 Hiring: Machine Learning (ML) Engineer Intern – Peakflo (YC-backed, Paid, Remote India)",r/IndiaInternshipDaily,2026-02-13T06:41:33+00:00,https://old.reddit.com/r/IndiaInternshipDaily/comments/1r3i3ek/hiring_machine_learning_ml_engineer_intern/,2026-07-01,1.0,reddit,hiring machine learning ml engineer intern peakflo ycbacked paid remote india,"['Artificial Intelligence', 'Machine Learning']",Artificial Intelligence,Machine Learning Engineer,Remote
machine learning engineer india,"🚀 Hiring: Machine Learning (ML) Engineer Intern – Peakflo (YC-backed, Paid, Remote India)",r/IndiaInternshipDaily,2026-02-13T06:41:33+00:00,https://old.reddit.com/r/IndiaInternshipDaily/comments/1r3i3ek/hiring_machine_learning_ml_engineer_intern/,2026-07-01,1.0,reddit,hiring machine learning ml engineer intern peakflo ycbacked paid remote india,"['Artificial Intelligence', 'Machine Learning']",Machine Learning,Machine Learning Engineer,Remote
machine learning engineer india,📢 Sourcingxpress is [hiring] a Machine Learning Engineer!,r/jobboardsearch,2026-04-23T14:15:20+00:00,https://old.reddit.com/r/jobboardsearch/comments/1stk0lz/sourcingxpress_is_hiring_a_machine_learning/,2026-07-01,1.0,reddit,sourcingxpress is hiring a machine learning engineer,['Machine Learning'],Machine Learning,Machine Learning Engineer,Unknown
machine learning engineer india,"Machine Learning (ML) Engineer Intern – Peakflo (Remote, Paid)",r/IndiaInternshipDaily,2026-03-17T11:05:52+00:00,https://old.reddit.com/r/IndiaInternshipDaily/comments/1rw3gga/machine_learning_ml_engineer_intern_peakflo/,2026-07-01,1.0,reddit,machine learning ml engineer intern peakflo remote paid,"['Artificial Intelligence', 'Machine Learning']",Artificial Intelligence,Machine Learning Engineer,Remote
machine learning engineer india,"Machine Learning (ML) Engineer Intern – Peakflo (Remote, Paid)",r/IndiaInternshipDaily,2026-03-17T11:05:52+00:00,https://old.reddit.com/r/IndiaInternshipDaily/comments/1rw3gga/machine_learning_ml_engineer_intern_peakflo/,2026-07-01,1.0,reddit,machine learning ml engineer intern peakflo remote paid,"['Artificial Intelligence', 'Machine Learning']",Machine Learning,Machine Learning Engineer,Remote
machine learning engineer india,Steps and question for becoming a machine learning engineer,r/learnmachinelearning,2025-10-26T13:53:25+00:00,https://old.reddit.com/r/learnmachinelearning/comments/1ogl6nq/steps_and_question_for_becoming_a_machine/,2026-07-01,1.0,reddit,steps and question for becoming a machine learning engineer,['Machine Learning'],Machine Learning,Machine Learning Engineer,Unknown
machine learning engineer india,"Machine Learning & Data Science Engineer, Upto ₹2.5 Cr",r/MachineLearningJobs,2025-09-23T14:42:22+00:00,https://old.reddit.com/r/MachineLearningJobs/comments/1noj966/machine_learning_data_science_engineer_upto_25_cr/,2026-07-01,1.0,reddit,machine learning data science engineer upto 25 cr,"['Data Science', 'Machine Learning']",Data Science,Unknown,Unknown
machine learning engineer india,"Machine Learning & Data Science Engineer, Upto ₹2.5 Cr",r/MachineLearningJobs,2025-09-23T14:42:22+00:00,https://old.reddit.com/r/MachineLearningJobs/comments/1noj966/machine_learning_data_science_engineer_upto_25_cr/,2026-07-01,1.0,reddit,machine learning data science engineer upto 25 cr,"['Data Science', 'Machine Learning']",Machine Learning,Unknown,Unknown
machine learning engineer india,"Cisco – Machine Learning Engineer Master’s (Intern) | Hyderabad, India",r/IndiaInternshipDaily,2026-02-09T06:33:14+00:00,https://old.reddit.com/r/IndiaInternshipDaily/comments/1qzwyf3/cisco_machine_learning_engineer_masters_intern/,2026-07-01,1.0,reddit,cisco machine learning engineer masters intern hyderabad india,['Machine Learning'],Machine Learning,Machine Learning Engineer,Hyderabad
machine learning engineer india,[HIRING] a Machine Learning Engineer! in Visa,r/jobboardsearch,2026-02-27T09:08:45+00:00,https://old.reddit.com/r/jobboardsearch/comments/1rg1t79/hiring_a_machine_learning_engineer_in_visa/,2026-07-01,1.0,reddit,hiring a machine learning engineer in visa,['Machine Learning'],Machine Learning,Machine Learning Engineer,Unknown
