keyword,title,subreddit,timestamp,post_url,scrape_date,batch_number,source,clean_title,skills_list,skill,role,location
IBM hiring,Self made billionaires,r/truths,2026-01-18T11:41:50+00:00,https://old.reddit.com/r/truths/comments/1qg6ih0/self_made_billionaires/,2026-07-01,3.0,reddit,self made billionaires,['Artificial Intelligence'],Artificial Intelligence,Unknown,Unknown
IBM hiring,"IBM plans to replace 7,800 jobs with AI over time, pauses hiring certain positions. IBM CEO Arvind Krishna says he could see 30% of back-office functions replaced by AI over 5 years.",r/Futurology,2023-05-06T16:39:58+00:00,https://old.reddit.com/r/Futurology/comments/139v0iq/ibm_plans_to_replace_7800_jobs_with_ai_over_time/,2026-07-01,3.0,reddit,ibm plans to replace 7800 jobs with ai over time pauses hiring certain positions ibm ceo arvind krishna says he could see 30 of backoffice functions replaced by ai over 5 years,['Artificial Intelligence'],Artificial Intelligence,Unknown,Unknown
IBM hiring,"IBM to pause hiring in plan to replace 7,800 jobs with AI - Bloomberg News",r/technews,2023-05-02T00:11:23+00:00,https://old.reddit.com/r/technews/comments/1355u80/ibm_to_pause_hiring_in_plan_to_replace_7800_jobs/,2026-07-01,3.0,reddit,ibm to pause hiring in plan to replace 7800 jobs with ai bloomberg news,['Artificial Intelligence'],Artificial Intelligence,Unknown,Unknown
Cognizant hiring,"Cognizant CEO is swimming against the tide on AI: he's hiring over 20,000 graduates this year and says AI tokenmaxxing is a 'vanity metric'",r/technology,2026-06-03T00:55:29+00:00,https://old.reddit.com/r/technology/comments/1tv9wz2/cognizant_ceo_is_swimming_against_the_tide_on_ai/,2026-07-01,3.0,reddit,cognizant ceo is swimming against the tide on ai hes hiring over 20000 graduates this year and says ai tokenmaxxing is a vanity metric,['Artificial Intelligence'],Artificial Intelligence,Unknown,Unknown
Cognizant hiring,"Cognizant CEO is swimming against the tide on AI: he's hiring over 20,000 graduates this year and says AI tokenmaxxing is a 'vanity metric' | Fortune",r/SimpleApplyAI,2026-06-03T13:59:37+00:00,https://old.reddit.com/r/SimpleApplyAI/comments/1tvq7ky/cognizant_ceo_is_swimming_against_the_tide_on_ai/,2026-07-01,3.0,reddit,cognizant ceo is swimming against the tide on ai hes hiring over 20000 graduates this year and says ai tokenmaxxing is a vanity metric fortune,['Artificial Intelligence'],Artificial Intelligence,Unknown,Unknown
Bangalore jobs,Anthropic of Claude fame is introducing AI Agents for financial services. This means more Big 4 bank job cutting are coming! It's not just going to Bangalore or Manilla. It's going to the cheapest form - AI and cost of electricity.,r/auscorp,2026-05-05T23:10:03+00:00,https://old.reddit.com/r/auscorp/comments/1t4vla5/anthropic_of_claude_fame_is_introducing_ai_agents/,2026-07-01,4.0,reddit,anthropic of claude fame is introducing ai agents for financial services this means more big 4 bank job cutting are coming its not just going to bangalore or manilla its going to the cheapest form ai and cost of electricity,['Artificial Intelligence'],Artificial Intelligence,Full Stack Developer,Bangalore
Bangalore jobs,How is Indore full of money without having Mumbai/Pune/Bangalore-level jobs?,r/Indore,2026-06-09T16:54:45+00:00,https://old.reddit.com/r/Indore/comments/1u1arr3/how_is_indore_full_of_money_without_having/,2026-07-01,4.0,reddit,how is indore full of money without having mumbaipunebangalorelevel jobs,['Artificial Intelligence'],Artificial Intelligence,Unknown,"Bangalore, Mumbai, Pune"
Bangalore jobs,"27M, 1LPM in Bangalore: Struggling to save for travel/gadgets amid AI job volatility",r/personalfinanceindia,2026-05-26T10:18:04+00:00,https://old.reddit.com/r/personalfinanceindia/comments/1to2ong/27m_1lpm_in_bangalore_struggling_to_save_for/,2026-07-01,4.0,reddit,27m 1lpm in bangalore struggling to save for travelgadgets amid ai job volatility,['Artificial Intelligence'],Artificial Intelligence,Unknown,Bangalore
Bangalore jobs,"[OC] My 12 month spending as a 25y/o Software Dev living in Chennai & Bangalore. Haven't seen similar charts for India and tech jobs, so decided to go through my finances and make my own.",r/india,2022-07-02T15:37:02+00:00,https://old.reddit.com/r/india/comments/vpudru/oc_my_12_month_spending_as_a_25yo_software_dev/,2026-07-01,4.0,reddit,oc my 12 month spending as a 25yo software dev living in chennai bangalore havent seen similar charts for india and tech jobs so decided to go through my finances and make my own,['Artificial Intelligence'],Artificial Intelligence,Unknown,"Bangalore, Chennai"
Hyderabad jobs,"TIL, The Guy who built Pytorch (framework that now runs 90% of all AI research on Earth) is a Telugu and a Hyderabadi. Cool Stuff",r/hyderabad,2026-05-23T13:05:36+00:00,https://old.reddit.com/r/hyderabad/comments/1tlfzn4/til_the_guy_who_built_pytorch_framework_that_now/,2026-07-01,4.0,reddit,til the guy who built pytorch framework that now runs 90 of all ai research on earth is a telugu and a hyderabadi cool stuff,['Artificial Intelligence'],Artificial Intelligence,Unknown,Hyderabad
Hyderabad jobs,"Man Complains to Police About Danger to Life; Cops Counsel Him to ""Adjust"", Wife Strangles Him One Week Later",r/hyderabad,2026-01-22T14:05:17+00:00,https://old.reddit.com/r/hyderabad/comments/1qjveb1/man_complains_to_police_about_danger_to_life_cops/,2026-07-01,4.0,reddit,man complains to police about danger to life cops counsel him to adjust wife strangles him one week later,['Artificial Intelligence'],Artificial Intelligence,Unknown,Unknown
Hyderabad jobs,"Exhausted with the job search. PM with 2.8 years of experience. Looking for opportunities in Hyderabad, Bengaluru, Mumbai or Pune Expectations: 700000-1000000 Rs. PA",r/StartUpIndia,2026-06-17T15:32:44+00:00,https://old.reddit.com/r/StartUpIndia/comments/1u8dhul/exhausted_with_the_job_search_pm_with_28_years_of/,2026-07-01,4.0,reddit,exhausted with the job search pm with 28 years of experience looking for opportunities in hyderabad bengaluru mumbai or pune expectations 7000001000000 rs pa,['Artificial Intelligence'],Artificial Intelligence,Unknown,"Bangalore, Hyderabad, Mumbai, Pune"
Hyderabad jobs,Need any small job that pays around 20k in Hyderabad for my maid's son,r/hyderabad,2025-07-31T02:56:46+00:00,https://old.reddit.com/r/hyderabad/comments/1mdqdzc/need_any_small_job_that_pays_around_20k_in/,2026-07-01,4.0,reddit,need any small job that pays around 20k in hyderabad for my maids son,['Artificial Intelligence'],Artificial Intelligence,Unknown,Hyderabad
Pune jobs,Moved to Pune 2 months ago for work. Ab samajh aa raha hai log itna hype kyun karte hain.,r/pune,2026-05-31T09:00:08+00:00,https://old.reddit.com/r/pune/comments/1tsq2e7/moved_to_pune_2_months_ago_for_work_ab_samajh_aa/,2026-07-01,4.0,reddit,moved to pune 2 months ago for work ab samajh aa raha hai log itna hype kyun karte hain,['Artificial Intelligence'],Artificial Intelligence,Unknown,Pune
Pune jobs,Beware: Fake Job Offer in Pune (Intelliflix) – Paid Training Scam,r/pune,2026-04-08T18:34:06+00:00,https://old.reddit.com/r/pune/comments/1sg1dl7/beware_fake_job_offer_in_pune_intelliflix_paid/,2026-07-01,4.0,reddit,beware fake job offer in pune intelliflix paid training scam,['Artificial Intelligence'],Artificial Intelligence,Unknown,Pune
Pune jobs,Is India is totally failed country,r/AskIndia,2025-03-13T16:20:43+00:00,https://old.reddit.com/r/AskIndia/comments/1jafvhc/is_india_is_totally_failed_country/,2026-07-01,4.0,reddit,is india is totally failed country,['Artificial Intelligence'],Artificial Intelligence,Unknown,Unknown
Delhi jobs,Scenes from Mega Job Fair in Delhi Today,r/delhi,2025-06-19T16:23:09+00:00,https://old.reddit.com/r/delhi/comments/1lff0zm/scenes_from_mega_job_fair_in_delhi_today/,2026-07-01,4.0,reddit,scenes from mega job fair in delhi today,['Artificial Intelligence'],Artificial Intelligence,Unknown,Delhi
Delhi jobs,A man named Mohammad quit his IT job to remove 1 kg of trash daily from Delhi roads,r/sundaysarthak,2026-01-08T11:49:08+00:00,https://old.reddit.com/r/sundaysarthak/comments/1q79rhc/a_man_named_mohammad_quit_his_it_job_to_remove_1/,2026-07-01,4.0,reddit,a man named mohammad quit his it job to remove 1 kg of trash daily from delhi roads,['Artificial Intelligence'],Artificial Intelligence,Unknown,Delhi
Delhi jobs,Just witnessed something that doesn't sit right--Delhi Police towing only Zomato delivery bikes while other vehicles parked in the same spot were left untouched. It's frustrating to see delivery riders who are just trying to do their jobs being treated unfairly.,r/IndiaSpeaks,2025-01-05T19:44:23+00:00,https://old.reddit.com/r/IndiaSpeaks/comments/1hufc89/just_witnessed_something_that_doesnt_sit/,2026-07-01,4.0,reddit,just witnessed something that doesnt sit rightdelhi police towing only zomato delivery bikes while other vehicles parked in the same spot were left untouched its frustrating to see delivery riders who are just trying to do their jobs being treated unfairly,['Artificial Intelligence'],Artificial Intelligence,Unknown,Delhi
Delhi jobs,"A job failed successfully... Air India aircraft damaged and struck on foot over bridge in New Delhi, India, while being transported to another location",r/onejob,2021-10-14T12:13:48+00:00,https://old.reddit.com/r/onejob/comments/q7yg2n/a_job_failed_successfully_air_india_aircraft/,2026-07-01,4.0,reddit,a job failed successfully air india aircraft damaged and struck on foot over bridge in new delhi india while being transported to another location,['Artificial Intelligence'],Artificial Intelligence,Unknown,Delhi
Delhi jobs,[New Update]: AITA for admitting to my daughter that I hate what she changed her name to?,r/BestofRedditorUpdates,2026-01-31T05:00:06+00:00,https://old.reddit.com/r/BestofRedditorUpdates/comments/1qrt5k0/new_update_aita_for_admitting_to_my_daughter_that/,2026-07-01,4.0,reddit,new update aita for admitting to my daughter that i hate what she changed her name to,['Artificial Intelligence'],Artificial Intelligence,Unknown,Unknown
Delhi jobs,"Hi, I'm Aishwarya Kandpal aka IndianSkinBlog! I'm a filmmaker turned beauty content creator from Delhi, undoing beauty standards, one filter-free post at a time. Ask me anything about skincare, haircare, how i balance a full time job with content creation, haters, trolls & how collaborations work!",r/AskIndianWomen,2024-06-20T14:17:37+00:00,https://old.reddit.com/r/AskIndianWomen/comments/1dkcre6/hi_im_aishwarya_kandpal_aka_indianskinblog_im_a/,2026-07-01,4.0,reddit,hi im aishwarya kandpal aka indianskinblog im a filmmaker turned beauty content creator from delhi undoing beauty standards one filterfree post at a time ask me anything about skincare haircare how i balance a full time job with content creation haters trolls how collaborations work,['Artificial Intelligence'],Artificial Intelligence,Unknown,Delhi
Noida jobs,I met a girl in the train and this happened part 2 FULLY EXPLAINED.,r/PataHaiAajKyaHua,2026-03-25T21:40:58+00:00,https://old.reddit.com/r/PataHaiAajKyaHua/comments/1s3oakc/i_met_a_girl_in_the_train_and_this_happened_part/,2026-07-01,4.0,reddit,i met a girl in the train and this happened part 2 fully explained,['Artificial Intelligence'],Artificial Intelligence,Unknown,Unknown
Gurgaon jobs,Dating in Gurgaon feels like a job interview with cocktails,r/gurgaon,2026-03-06T06:19:21+00:00,https://old.reddit.com/r/gurgaon/comments/1rm6b3u/dating_in_gurgaon_feels_like_a_job_interview_with/,2026-07-01,4.0,reddit,dating in gurgaon feels like a job interview with cocktails,['Artificial Intelligence'],Artificial Intelligence,Unknown,Gurgaon
Gurgaon jobs,"32 year old, laid off last year, location Gurgaon, a family to take care of, no new jobs in sight, have 15lacs in savings account, decided to put some money and start driving cabs immediately.",r/indiasocial,2026-06-17T19:21:28+00:00,https://old.reddit.com/r/indiasocial/comments/1u8jtlu/32_year_old_laid_off_last_year_location_gurgaon_a/,2026-07-01,4.0,reddit,32 year old laid off last year location gurgaon a family to take care of no new jobs in sight have 15lacs in savings account decided to put some money and start driving cabs immediately,['Artificial Intelligence'],Artificial Intelligence,Unknown,Gurgaon
Gurgaon jobs,Buy ₹2Cr apartment in Gurgaon for 10 years or continue renting given AI/job uncertainty?,r/personalfinanceindia,2026-04-16T08:48:00+00:00,https://old.reddit.com/r/personalfinanceindia/comments/1smxub5/buy_2cr_apartment_in_gurgaon_for_10_years_or/,2026-07-01,4.0,reddit,buy 2cr apartment in gurgaon for 10 years or continue renting given aijob uncertainty,['Artificial Intelligence'],Artificial Intelligence,Unknown,Gurgaon
Gurgaon jobs,Thank God Mumbai isn't like Delhi!,r/mumbai,2025-11-15T13:17:38+00:00,https://old.reddit.com/r/mumbai/comments/1oxri51/thank_god_mumbai_isnt_like_delhi/,2026-07-01,4.0,reddit,thank god mumbai isnt like delhi,['Artificial Intelligence'],Artificial Intelligence,Unknown,"Delhi, Mumbai"
Mumbai jobs,Looking for a job in Mumbai,r/mumbai,2026-06-03T13:45:32+00:00,https://old.reddit.com/r/mumbai/comments/1tvptzu/looking_for_a_job_in_mumbai/,2026-07-01,4.0,reddit,looking for a job in mumbai,['Artificial Intelligence'],Artificial Intelligence,Unknown,Mumbai
Mumbai jobs,Job Openings in Mumbai (28F),r/mumbai,2026-06-15T11:24:10+00:00,https://old.reddit.com/r/mumbai/comments/1u6dseo/job_openings_in_mumbai_28f/,2026-07-01,4.0,reddit,job openings in mumbai 28f,['Artificial Intelligence'],Artificial Intelligence,Unknown,Mumbai
Mumbai jobs,18M Looking for a Full-Time Job in Mumbai - Open to Any Role,r/mumbai,2026-06-15T05:46:28+00:00,https://old.reddit.com/r/mumbai/comments/1u67tcp/18m_looking_for_a_fulltime_job_in_mumbai_open_to/,2026-07-01,4.0,reddit,18m looking for a fulltime job in mumbai open to any role,['Artificial Intelligence'],Artificial Intelligence,Unknown,Mumbai
Mumbai jobs,18M Looking for a Full-Time Job in Mumbai - Open to Any Role,r/MumbaiJobsOpenings,2026-06-15T05:47:56+00:00,https://old.reddit.com/r/MumbaiJobsOpenings/comments/1u67ucs/18m_looking_for_a_fulltime_job_in_mumbai_open_to/,2026-07-01,4.0,reddit,18m looking for a fulltime job in mumbai open to any role,['Artificial Intelligence'],Artificial Intelligence,Unknown,Mumbai
Mumbai jobs,Please Help!! My friend is falling apart — we’re desperately looking for a job in mumbai or navi mumbai,r/navimumbai,2025-07-21T22:46:37+00:00,https://old.reddit.com/r/navimumbai/comments/1m5xj88/please_help_my_friend_is_falling_apart_were/,2026-07-01,4.0,reddit,please help my friend is falling apart were desperately looking for a job in mumbai or navi mumbai,['Artificial Intelligence'],Artificial Intelligence,Unknown,Mumbai
Mumbai jobs,"Never forget your roots. One day you're taking selfies on a random Mumbai roadside, the next day you're taking his job",r/actualcricketshitpost,2026-06-06T14:42:02+00:00,https://old.reddit.com/r/actualcricketshitpost/comments/1tyj2vy/never_forget_your_roots_one_day_youre_taking/,2026-07-01,4.0,reddit,never forget your roots one day youre taking selfies on a random mumbai roadside the next day youre taking his job,['Artificial Intelligence'],Artificial Intelligence,Unknown,Mumbai
Mumbai jobs,GenZ not wanting to move to Mumbai for jobs?,r/mumbai,2025-05-17T18:34:58+00:00,https://old.reddit.com/r/mumbai/comments/1kozwse/genz_not_wanting_to_move_to_mumbai_for_jobs/,2026-07-01,4.0,reddit,genz not wanting to move to mumbai for jobs,['Artificial Intelligence'],Artificial Intelligence,Unknown,Mumbai
Mumbai jobs,Massive crowd of job seekers turns up for interview in Mumbai,r/mumbai,2024-07-17T06:26:11+00:00,https://old.reddit.com/r/mumbai/comments/1e5b7wv/massive_crowd_of_job_seekers_turns_up_for/,2026-07-01,4.0,reddit,massive crowd of job seekers turns up for interview in mumbai,['Artificial Intelligence'],Artificial Intelligence,Unknown,Mumbai
Mumbai jobs,"24M in Mumbai. Lost both my parents, stuck in a low-paying job, and the loneliness is brutal.",r/mumbai,2026-06-08T07:40:39+00:00,https://old.reddit.com/r/mumbai/comments/1u0143m/24m_in_mumbai_lost_both_my_parents_stuck_in_a/,2026-07-01,4.0,reddit,24m in mumbai lost both my parents stuck in a lowpaying job and the loneliness is brutal,['Artificial Intelligence'],Artificial Intelligence,Unknown,Mumbai
Mumbai jobs,"25,000 Aspirants For Airport Job Paying Rs 22,000: A Mumbai Stampede Scare",r/india,2024-07-17T05:55:38+00:00,https://old.reddit.com/r/india/comments/1e5aqkz/25000_aspirants_for_airport_job_paying_rs_22000_a/,2026-07-01,4.0,reddit,25000 aspirants for airport job paying rs 22000 a mumbai stampede scare,['Artificial Intelligence'],Artificial Intelligence,Unknown,Mumbai
Mumbai jobs,I am planning to join a job in Mumbai over one in Paris. Is that delusional?,r/developersIndia,2024-07-28T11:13:40+00:00,https://old.reddit.com/r/developersIndia/comments/1ee52w1/i_am_planning_to_join_a_job_in_mumbai_over_one_in/,2026-07-01,4.0,reddit,i am planning to join a job in mumbai over one in paris is that delusional,['Artificial Intelligence'],Artificial Intelligence,Unknown,Mumbai
Mumbai jobs,Left Mumbai for a Tier 3 Town for Job — No Regrets,r/mumbai,2026-02-24T22:08:21+00:00,https://old.reddit.com/r/mumbai/comments/1rdufoo/left_mumbai_for_a_tier_3_town_for_job_no_regrets/,2026-07-01,4.0,reddit,left mumbai for a tier 3 town for job no regrets,['Artificial Intelligence'],Artificial Intelligence,Unknown,Mumbai
Mumbai jobs,"He's Sonu Sood, an Indian Actor who fed 45,000 people daily in Mumbai during the 3 months of lockdown, has sent 20,000 migrants to their homes, has arranged flights for the students stuck in other countries and also laid out a mission to provide 3 Lakh jobs.",r/nextfuckinglevel,2020-08-16T14:49:45+00:00,https://old.reddit.com/r/nextfuckinglevel/comments/iatm22/hes_sonu_sood_an_indian_actor_who_fed_45000/,2026-07-01,4.0,reddit,hes sonu sood an indian actor who fed 45000 people daily in mumbai during the 3 months of lockdown has sent 20000 migrants to their homes has arranged flights for the students stuck in other countries and also laid out a mission to provide 3 lakh jobs,['Artificial Intelligence'],Artificial Intelligence,Unknown,Mumbai
Mumbai jobs,Job switch - 25 in BLR or 30 in Mumbai - suggestions?,r/developersIndia,2025-11-17T07:54:57+00:00,https://old.reddit.com/r/developersIndia/comments/1ozahve/job_switch_25_in_blr_or_30_in_mumbai_suggestions/,2026-07-01,4.0,reddit,job switch 25 in blr or 30 in mumbai suggestions,['Artificial Intelligence'],Artificial Intelligence,Unknown,Mumbai
Mumbai jobs,My brother got job in fort area of Mumbai,r/mumbai,2026-06-04T08:00:59+00:00,https://old.reddit.com/r/mumbai/comments/1twh0yz/my_brother_got_job_in_fort_area_of_mumbai/,2026-07-01,4.0,reddit,my brother got job in fort area of mumbai,['Artificial Intelligence'],Artificial Intelligence,Unknown,Mumbai
Mumbai jobs,"Job in Mumbai, Maharashtra, Preference Given to G/M Candidates.",r/MaharashtraTalks,2026-06-10T05:14:32+00:00,https://old.reddit.com/r/MaharashtraTalks/comments/1u1ssp0/job_in_mumbai_maharashtra_preference_given_to_gm/,2026-07-01,4.0,reddit,job in mumbai maharashtra preference given to gm candidates,['Artificial Intelligence'],Artificial Intelligence,Unknown,Mumbai
Mumbai jobs,Worth moving to Mumbai from SE Asia? Got a job offer.,r/mumbai,2024-07-02T14:57:14+00:00,https://old.reddit.com/r/mumbai/comments/1dtnv18/worth_moving_to_mumbai_from_se_asia_got_a_job/,2026-07-01,4.0,reddit,worth moving to mumbai from se asia got a job offer,['Artificial Intelligence'],Artificial Intelligence,Unknown,Mumbai
Mumbai jobs,"35 lakh houses x 4 persons = ~14 million people. Imagine the immense pressure this will put on Mumbai's infrastructure, jobs, and housing. Meanwhile, locals risk being pushed out of employment opportunities. This policy will ultimately hurt the future of the sons of the soil.",r/MaharashtraTalks,2026-04-16T12:08:36+00:00,https://old.reddit.com/r/MaharashtraTalks/comments/1sn1mct/35_lakh_houses_x_4_persons_14_million_people/,2026-07-01,4.0,reddit,35 lakh houses x 4 persons 14 million people imagine the immense pressure this will put on mumbais infrastructure jobs and housing meanwhile locals risk being pushed out of employment opportunities this policy will ultimately hurt the future of the sons of the soil,['Artificial Intelligence'],Artificial Intelligence,Full Stack Developer,Mumbai
Mumbai jobs,North Indians distraught over Marathi language proficiency test (LPT) for RBI jobs in Mumbai | RBI च्या मुंबईतील नोकर्‍यांच्या मराठी प्रावीण्य परीक्षेमुळे उत्तर भारतीयांना पोटशूळ. तुमचे मत काय ?,r/Maharashtra,2026-03-22T05:14:37+00:00,https://old.reddit.com/r/Maharashtra/comments/1s0d62x/north_indians_distraught_over_marathi_language/,2026-07-01,4.0,reddit,north indians distraught over marathi language proficiency test lpt for rbi jobs in mumbai rbi,['Artificial Intelligence'],Artificial Intelligence,Unknown,Mumbai
Chennai jobs,Anyone want a job in Chennai?,r/chennaicity,2026-05-11T18:05:11+00:00,https://old.reddit.com/r/chennaicity/comments/1tab9es/anyone_want_a_job_in_chennai/,2026-07-01,4.0,reddit,anyone want a job in chennai,['Artificial Intelligence'],Artificial Intelligence,Unknown,Chennai
Chennai jobs,Are there high paying jobs in Chennai?,r/Chennai,2026-01-25T12:50:07+00:00,https://old.reddit.com/r/Chennai/comments/1qmia6h/are_there_high_paying_jobs_in_chennai/,2026-07-01,4.0,reddit,are there high paying jobs in chennai,['Artificial Intelligence'],Artificial Intelligence,Unknown,Chennai
Chennai jobs,Part time jobs in chennai,r/chennaihiring,2026-05-04T22:47:20+00:00,https://old.reddit.com/r/chennaihiring/comments/1t3xdml/part_time_jobs_in_chennai/,2026-07-01,4.0,reddit,part time jobs in chennai,['Artificial Intelligence'],Artificial Intelligence,Unknown,Chennai
Chennai jobs,A Chennai person's slightly chaotic attempt at building a physical product from a desk job background - would love brutal feedback,r/Chennai,2026-05-02T07:16:16+00:00,https://old.reddit.com/r/Chennai/comments/1t1ivme/a_chennai_persons_slightly_chaotic_attempt_at/,2026-07-01,4.0,reddit,a chennai persons slightly chaotic attempt at building a physical product from a desk job background would love brutal feedback,['Artificial Intelligence'],Artificial Intelligence,Unknown,Chennai
Chennai jobs,"Job cuts in Amazon. 14,000 managerial roles will be cut before 2025. Chennai folks in Brigade world trade center beware.",r/developersIndia,2024-10-05T07:06:32+00:00,https://old.reddit.com/r/developersIndia/comments/1fwkoux/job_cuts_in_amazon_14000_managerial_roles_will_be/,2026-07-01,4.0,reddit,job cuts in amazon 14000 managerial roles will be cut before 2025 chennai folks in brigade world trade center beware,['Artificial Intelligence'],Artificial Intelligence,Unknown,Chennai
Chennai jobs,"Need advice on choosing between 3 job offers — remote vs hybrid, shift, stability, and Chennai cost of living",r/developersIndia,2026-06-17T12:09:57+00:00,https://old.reddit.com/r/developersIndia/comments/1u88elf/need_advice_on_choosing_between_3_job_offers/,2026-07-01,4.0,reddit,need advice on choosing between 3 job offers remote vs hybrid shift stability and chennai cost of living,['Artificial Intelligence'],Artificial Intelligence,Unknown,"Chennai, Remote"
Chennai jobs,"Shriramya Chandra from Chennai gets 250 rupees per hour. For this, she has to record daily household chores at home. Such videos are used to train AI robots. In many factories, workers are also recording their tasks. But this is putting their jobs at risk.",r/StartupFuture,2026-06-12T10:04:08+00:00,https://old.reddit.com/r/StartupFuture/comments/1u3r1x4/shriramya_chandra_from_chennai_gets_250_rupees/,2026-07-01,4.0,reddit,shriramya chandra from chennai gets 250 rupees per hour for this she has to record daily household chores at home such videos are used to train ai robots in many factories workers are also recording their tasks but this is putting their jobs at risk,['Artificial Intelligence'],Artificial Intelligence,Unknown,Chennai
Chennai jobs,Chennai will never have a startup unicorn. The city is too risk-averse and everyone just wants a government job,r/chennaicity,2026-04-20T18:08:42+00:00,https://old.reddit.com/r/chennaicity/comments/1sqxdvt/chennai_will_never_have_a_startup_unicorn_the/,2026-07-01,4.0,reddit,chennai will never have a startup unicorn the city is too riskaverse and everyone just wants a government job,['Artificial Intelligence'],Artificial Intelligence,Unknown,Chennai
Chennai jobs,"Should I Quit Cognizant job (4 LPA, Chennai) for GATE DA prep?",r/developersIndia,2026-04-18T06:26:32+00:00,https://old.reddit.com/r/developersIndia/comments/1soptxb/should_i_quit_cognizant_job_4_lpa_chennai_for/,2026-07-01,4.0,reddit,should i quit cognizant job 4 lpa chennai for gate da prep,['Artificial Intelligence'],Artificial Intelligence,Unknown,Chennai
Chennai jobs,Moving from Chennai to Chhatrapati Sambhajinagar for My First Job Near AURIC City (Bidkin) – Need Some Advice!,r/Aurangabad,2026-06-21T20:05:41+00:00,https://old.reddit.com/r/Aurangabad/comments/1ubzsln/moving_from_chennai_to_chhatrapati_sambhajinagar/,2026-07-01,4.0,reddit,moving from chennai to chhatrapati sambhajinagar for my first job near auric city bidkin need some advice,['Artificial Intelligence'],Artificial Intelligence,Unknown,Chennai
Chennai jobs,"Possible job scam in Chennai (Teynampet) – asking ₹4,500 upfront for data entry job",r/Scams,2026-06-24T18:06:29+00:00,https://old.reddit.com/r/Scams/comments/1uel2bk/possible_job_scam_in_chennai_teynampet_asking/,2026-07-01,4.0,reddit,possible job scam in chennai teynampet asking 4500 upfront for data entry job,['Artificial Intelligence'],Artificial Intelligence,Unknown,Chennai
