keyword,title,subreddit,timestamp,post_url,scrape_date,batch_number,source,clean_title,skills_list,skill,role,location
ML internship india,"600+ AI/ML Internship Applications, 0 Interviews, Hiring Managers and Recruiters, What Am I Doing Wrong?",r/DataScientist,2026-05-18T23:03:35+00:00,https://old.reddit.com/r/DataScientist/comments/1th4ke6/600_aiml_internship_applications_0_interviews/,2026-07-01,2.0,reddit,600 aiml internship applications 0 interviews hiring managers and recruiters what am i doing wrong,"['Artificial Intelligence', 'Machine Learning']",Artificial Intelligence,Intern,Unknown
ML internship india,"600+ AI/ML Internship Applications, 0 Interviews, Hiring Managers and Recruiters, What Am I Doing Wrong?",r/DataScientist,2026-05-18T23:03:35+00:00,https://old.reddit.com/r/DataScientist/comments/1th4ke6/600_aiml_internship_applications_0_interviews/,2026-07-01,2.0,reddit,600 aiml internship applications 0 interviews hiring managers and recruiters what am i doing wrong,"['Artificial Intelligence', 'Machine Learning']",Machine Learning,Intern,Unknown
ML internship india,Pls review my resume for ml related internships. Need advice on how do I secure ml internships,r/developersIndia,2026-06-24T16:47:26+00:00,https://old.reddit.com/r/developersIndia/comments/1ueivf7/pls_review_my_resume_for_ml_related_internships/,2026-07-01,2.0,reddit,pls review my resume for ml related internships need advice on how do i secure ml internships,['Machine Learning'],Machine Learning,Intern,Unknown
ML internship india,Resume Review + AI/ML Internship Opportunities | Seeking Honest Feedback,r/InternshipsIndia,2026-05-25T04:16:50+00:00,https://old.reddit.com/r/InternshipsIndia/comments/1tmy28s/resume_review_aiml_internship_opportunities/,2026-07-01,2.0,reddit,resume review aiml internship opportunities seeking honest feedback,"['Artificial Intelligence', 'Machine Learning']",Artificial Intelligence,Intern,Unknown
ML internship india,Resume Review + AI/ML Internship Opportunities | Seeking Honest Feedback,r/InternshipsIndia,2026-05-25T04:16:50+00:00,https://old.reddit.com/r/InternshipsIndia/comments/1tmy28s/resume_review_aiml_internship_opportunities/,2026-07-01,2.0,reddit,resume review aiml internship opportunities seeking honest feedback,"['Artificial Intelligence', 'Machine Learning']",Machine Learning,Intern,Unknown
ML internship india,[FOR HIRE] Data Analyst / Data Scientist / AI-ML | Open to Remote & Anywhere in India 🇮🇳,r/indiafreshers,2026-05-01T19:09:17+00:00,https://old.reddit.com/r/indiafreshers/comments/1t12tsq/for_hire_data_analyst_data_scientist_aiml_open_to/,2026-07-01,2.0,reddit,for hire data analyst data scientist aiml open to remote anywhere in india,"['Artificial Intelligence', 'Data Science', 'Machine Learning']",Artificial Intelligence,Data Scientist,Remote
ML internship india,[FOR HIRE] Data Analyst / Data Scientist / AI-ML | Open to Remote & Anywhere in India 🇮🇳,r/indiafreshers,2026-05-01T19:09:17+00:00,https://old.reddit.com/r/indiafreshers/comments/1t12tsq/for_hire_data_analyst_data_scientist_aiml_open_to/,2026-07-01,2.0,reddit,for hire data analyst data scientist aiml open to remote anywhere in india,"['Artificial Intelligence', 'Data Science', 'Machine Learning']",Data Science,Data Scientist,Remote
ML internship india,[FOR HIRE] Data Analyst / Data Scientist / AI-ML | Open to Remote & Anywhere in India 🇮🇳,r/indiafreshers,2026-05-01T19:09:17+00:00,https://old.reddit.com/r/indiafreshers/comments/1t12tsq/for_hire_data_analyst_data_scientist_aiml_open_to/,2026-07-01,2.0,reddit,for hire data analyst data scientist aiml open to remote anywhere in india,"['Artificial Intelligence', 'Data Science', 'Machine Learning']",Machine Learning,Data Scientist,Remote
data internship india,Masters + Data Engineer ( 2 years rom India ) - Master's in Germany/Netherlands or gain more experience first?,r/Indians_StudyAbroad,2026-06-05T08:13:44+00:00,https://old.reddit.com/r/Indians_StudyAbroad/comments/1txend5/masters_data_engineer_2_years_rom_india_masters/,2026-07-01,2.0,reddit,masters data engineer 2 years rom india masters in germanynetherlands or gain more experience first,['Artificial Intelligence'],Artificial Intelligence,Unknown,Unknown
data internship india,"19-Year-Old Data Science Student Open to Technical Internships, Project Work",r/IndiaInternshipDaily,2026-06-17T21:33:47+00:00,https://old.reddit.com/r/IndiaInternshipDaily/comments/1u8ncvp/19yearold_data_science_student_open_to_technical/,2026-07-01,2.0,reddit,19yearold data science student open to technical internships project work,['Data Science'],Data Science,Intern,Unknown
data internship india,Salary range for data scientist positions in India?,r/developersIndia,2026-04-06T17:53:10+00:00,https://old.reddit.com/r/developersIndia/comments/1se65jk/salary_range_for_data_scientist_positions_in_india/,2026-07-01,2.0,reddit,salary range for data scientist positions in india,['Data Science'],Data Science,Data Scientist,Unknown
data internship india,"19-Year-Old Data Science Student Open to Technical Internships, Project Work",r/InternshipsIndia,2026-06-17T21:39:42+00:00,https://old.reddit.com/r/InternshipsIndia/comments/1u8nigi/19yearold_data_science_student_open_to_technical/,2026-07-01,2.0,reddit,19yearold data science student open to technical internships project work,['Data Science'],Data Science,Intern,Unknown
data internship india,Looking for internship opportunities | Data Analyst | Data Scientist,r/InternshipsIndia,2026-05-31T05:15:17+00:00,https://old.reddit.com/r/InternshipsIndia/comments/1tsm1y8/looking_for_internship_opportunities_data_analyst/,2026-07-01,2.0,reddit,looking for internship opportunities data analyst data scientist,['Data Science'],Data Science,Data Scientist,Unknown
data internship india,Resume format that recruiters look for AI / data internship.,r/cscareerquestionsOCE,2026-03-30T07:45:17+00:00,https://old.reddit.com/r/cscareerquestionsOCE/comments/1s7k3ml/resume_format_that_recruiters_look_for_ai_data/,2026-07-01,2.0,reddit,resume format that recruiters look for ai data internship,['Artificial Intelligence'],Artificial Intelligence,Intern,Unknown
data internship india,How do students from Germany/Europe return to India and land 25+ LPA Data Science jobs after M.Tech/MS?,r/returnToIndia,2026-05-22T12:41:30+00:00,https://old.reddit.com/r/returnToIndia/comments/1tkhtyi/how_do_students_from_germanyeurope_return_to/,2026-07-01,2.0,reddit,how do students from germanyeurope return to india and land 25 lpa data science jobs after mtechms,['Data Science'],Data Science,Unknown,Unknown
data internship india,"19-Year-Old Data Science Student Open to Technical Internships, Project Work",r/PaidInternships,2026-06-17T21:41:17+00:00,https://old.reddit.com/r/PaidInternships/comments/1u8njww/19yearold_data_science_student_open_to_technical/,2026-07-01,2.0,reddit,19yearold data science student open to technical internships project work,['Data Science'],Data Science,Intern,Unknown
summer internship india,Need Help Finding Legit Summer Internships (2nd Year Student),r/Btechtards,2026-03-28T12:29:43+00:00,https://old.reddit.com/r/Btechtards/comments/1s5z1sn/need_help_finding_legit_summer_internships_2nd/,2026-07-01,2.0,reddit,need help finding legit summer internships 2nd year student,['Git'],Git,Intern,Unknown
summer internship india,Is this resume enough to get a paid/unpaid intership as a 4th sem student as college is forcing for a summer internship( also want to develop skill ),r/InternshipsIndia,2026-05-13T11:16:00+00:00,https://old.reddit.com/r/InternshipsIndia/comments/1tbwjwt/is_this_resume_enough_to_get_a_paidunpaid/,2026-07-01,2.0,reddit,is this resume enough to get a paidunpaid intership as a 4th sem student as college is forcing for a summer internship also want to develop skill,['Artificial Intelligence'],Artificial Intelligence,Intern,Unknown
summer internship india,Can somebody give brutal Honestly review on my resume? I really want internship or either i have to do college certifications for summer internship credit which are paid,r/CodingJobs,2026-05-09T05:47:24+00:00,https://old.reddit.com/r/CodingJobs/comments/1t7w6pz/can_somebody_give_brutal_honestly_review_on_my/,2026-07-01,2.0,reddit,can somebody give brutal honestly review on my resume i really want internship or either i have to do college certifications for summer internship credit which are paid,['Artificial Intelligence'],Artificial Intelligence,Intern,Unknown
winter internship india,"Emailed a professor for a Winter Internship 3 days ago, how long should I wait for her reply before trying out for other professors in the same institute?",r/labrats,2025-10-08T18:32:57+00:00,https://old.reddit.com/r/labrats/comments/1o1ive0/emailed_a_professor_for_a_winter_internship_3/,2026-07-01,2.0,reddit,emailed a professor for a winter internship 3 days ago how long should i wait for her reply before trying out for other professors in the same institute,['Artificial Intelligence'],Artificial Intelligence,Intern,Unknown
winter internship india,🚀 Digital India Internship 2025 – Applications Open! 🇮🇳,r/ambitionarena7,2025-11-14T14:14:00+00:00,https://old.reddit.com/r/ambitionarena7/comments/1owxkxv/digital_india_internship_2025_applications_open/,2026-07-01,2.0,reddit,digital india internship 2025 applications open,['Git'],Git,Intern,Unknown
winter internship india,"Emailed a professor for a Winter Internship 3 days ago, how long should I wait for her reply before trying out for other professors in the same institute?",r/AskAcademia,2025-10-08T18:38:39+00:00,https://old.reddit.com/r/AskAcademia/comments/1o1j15l/emailed_a_professor_for_a_winter_internship_3/,2026-07-01,2.0,reddit,emailed a professor for a winter internship 3 days ago how long should i wait for her reply before trying out for other professors in the same institute,['Artificial Intelligence'],Artificial Intelligence,Intern,Unknown
winter internship india,"IMG from India, Usmle step 1 pass, looking for electives in next fall/winter in 2026",r/GeneralSurgery,2025-07-28T07:51:51+00:00,https://old.reddit.com/r/GeneralSurgery/comments/1mba4oe/img_from_india_usmle_step_1_pass_looking_for/,2026-07-01,2.0,reddit,img from india usmle step 1 pass looking for electives in next fallwinter in 2026,['Machine Learning'],Machine Learning,Unknown,Unknown
web development internship,[HIRING] Web Developer Intern | AI workflow a big plus | Rs.5k-8k/mo | DM your portfolio,r/IndiaInternshipDaily,2026-06-07T13:44:40+00:00,https://old.reddit.com/r/IndiaInternshipDaily/comments/1tzcjz1/hiring_web_developer_intern_ai_workflow_a_big/,2026-07-01,2.0,reddit,hiring web developer intern ai workflow a big plus rs5k8kmo dm your portfolio,['Artificial Intelligence'],Artificial Intelligence,Software Engineer,Unknown
web development internship,"How I landed a fully remote, paid python developer internship without a college degree (of any kind) or going through a bootcamp.",r/learnprogramming,2022-09-25T00:45:55+00:00,https://old.reddit.com/r/learnprogramming/comments/xn90c2/how_i_landed_a_fully_remote_paid_python_developer/,2026-07-01,2.0,reddit,how i landed a fully remote paid python developer internship without a college degree of any kind or going through a bootcamp,"['Artificial Intelligence', 'Python']",Artificial Intelligence,Software Engineer,Remote
web development internship,"How I landed a fully remote, paid python developer internship without a college degree (of any kind) or going through a bootcamp.",r/learnprogramming,2022-09-25T00:45:55+00:00,https://old.reddit.com/r/learnprogramming/comments/xn90c2/how_i_landed_a_fully_remote_paid_python_developer/,2026-07-01,2.0,reddit,how i landed a fully remote paid python developer internship without a college degree of any kind or going through a bootcamp,"['Artificial Intelligence', 'Python']",Python,Software Engineer,Remote
web development internship,"My friends kept asking me to make a web dev tutorial for complete beginners... after three years of requests, I finally gave in. Here's my intro to web dev and modern HTML for anyone completely new to web development.",r/learnprogramming,2020-06-04T17:27:33+00:00,https://old.reddit.com/r/learnprogramming/comments/gwlwvr/my_friends_kept_asking_me_to_make_a_web_dev/,2026-07-01,2.0,reddit,my friends kept asking me to make a web dev tutorial for complete beginners after three years of requests i finally gave in heres my intro to web dev and modern html for anyone completely new to web development,['Machine Learning'],Machine Learning,Unknown,Unknown
web development internship,"[unpaid] NOT for skilled developer. I'm part of a startup, looking for someone to join US. Unpaid internship though. can't pay as its our early phase.",r/indiafreshers,2026-06-06T18:13:18+00:00,https://old.reddit.com/r/indiafreshers/comments/1tyoio5/unpaid_not_for_skilled_developer_im_part_of_a/,2026-07-01,2.0,reddit,unpaid not for skilled developer im part of a startup looking for someone to join us unpaid internship though cant pay as its our early phase,['Artificial Intelligence'],Artificial Intelligence,Software Engineer,Unknown
web development internship,"I finally got an UNPAID internship as a freelance developer with 4 years of experience working in different tech stacks who understand Web Dev, Data Structures, and Algorithms decent enough.",r/developersPak,2026-06-28T06:09:48+00:00,https://old.reddit.com/r/developersPak/comments/1uhpe39/i_finally_got_an_unpaid_internship_as_a_freelance/,2026-07-01,2.0,reddit,i finally got an unpaid internship as a freelance developer with 4 years of experience working in different tech stacks who understand web dev data structures and algorithms decent enough,['Artificial Intelligence'],Artificial Intelligence,Software Engineer,Unknown
python internship,PLS HELPPP!!! Python Project Ideas,r/learnpython,2025-12-15T04:34:49+00:00,https://old.reddit.com/r/learnpython/comments/1pmyjxm/pls_helppp_python_project_ideas/,2026-07-01,2.0,reddit,pls helppp python project ideas,['Python'],Python,Unknown,Unknown
python internship,"I was tired of opening 100s of tabs for internship apps. So, I made an app to apply to 100 internships with one click with Selenium and Python (source code linked)!",r/programming,2019-10-03T05:07:20+00:00,https://old.reddit.com/r/programming/comments/dcmbzx/i_was_tired_of_opening_100s_of_tabs_for/,2026-07-01,2.0,reddit,i was tired of opening 100s of tabs for internship apps so i made an app to apply to 100 internships with one click with selenium and python source code linked,['Python'],Python,Intern,Unknown
python internship,I made an application bot to apply to 100 internships with one click using Selenium and Python! Try it out for yourself (source code linked)!,r/Python,2019-10-03T04:02:37+00:00,https://old.reddit.com/r/Python/comments/dclphq/i_made_an_application_bot_to_apply_to_100/,2026-07-01,2.0,reddit,i made an application bot to apply to 100 internships with one click using selenium and python try it out for yourself source code linked,['Python'],Python,Intern,Unknown
python internship,"Is Mindrisers' ""100% Internship Guarantee"" Worth It for Python Full Stack?",r/technepal,2026-06-09T08:49:38+00:00,https://old.reddit.com/r/technepal/comments/1u0zfti/is_mindrisers_100_internship_guarantee_worth_it/,2026-07-01,2.0,reddit,is mindrisers 100 internship guarantee worth it for python full stack,['Python'],Python,Full Stack Developer,Unknown
python internship,"Title: 23.M, MCA (Tier-3). Stuck in an unpaid, WFH PHP internship. Should I stay for 6 months, switch to Python, or move to Bangalore?",r/FresherTechJobsIndia,2026-06-30T06:59:52+00:00,https://old.reddit.com/r/FresherTechJobsIndia/comments/1ujhusa/title_23m_mca_tier3_stuck_in_an_unpaid_wfh_php/,2026-07-01,2.0,reddit,title 23m mca tier3 stuck in an unpaid wfh php internship should i stay for 6 months switch to python or move to bangalore,"['Artificial Intelligence', 'Python']",Artificial Intelligence,Intern,"Bangalore, Remote"
python internship,"Title: 23.M, MCA (Tier-3). Stuck in an unpaid, WFH PHP internship. Should I stay for 6 months, switch to Python, or move to Bangalore?",r/FresherTechJobsIndia,2026-06-30T06:59:52+00:00,https://old.reddit.com/r/FresherTechJobsIndia/comments/1ujhusa/title_23m_mca_tier3_stuck_in_an_unpaid_wfh_php/,2026-07-01,2.0,reddit,title 23m mca tier3 stuck in an unpaid wfh php internship should i stay for 6 months switch to python or move to bangalore,"['Artificial Intelligence', 'Python']",Python,Intern,"Bangalore, Remote"
python internship,is a python certificate necessary for getting internships and job apportunities?,r/learnpython,2026-05-20T16:58:09+00:00,https://old.reddit.com/r/learnpython/comments/1tirqbc/is_a_python_certificate_necessary_for_getting/,2026-07-01,2.0,reddit,is a python certificate necessary for getting internships and job apportunities,['Python'],Python,Intern,Unknown
python internship,Should i even start applying for internships? ( am a upcoming Sophomore in a ok cllg in AI branch with some what knowledge in python and java with 2-3 okish projects ),r/internships,2026-05-01T07:41:57+00:00,https://old.reddit.com/r/internships/comments/1t0mmke/should_i_even_start_applying_for_internships_am_a/,2026-07-01,2.0,reddit,should i even start applying for internships am a upcoming sophomore in a ok cllg in ai branch with some what knowledge in python and java with 23 okish projects,"['Artificial Intelligence', 'Java', 'Python']",Artificial Intelligence,Intern,Unknown
python internship,Should i even start applying for internships? ( am a upcoming Sophomore in a ok cllg in AI branch with some what knowledge in python and java with 2-3 okish projects ),r/internships,2026-05-01T07:41:57+00:00,https://old.reddit.com/r/internships/comments/1t0mmke/should_i_even_start_applying_for_internships_am_a/,2026-07-01,2.0,reddit,should i even start applying for internships am a upcoming sophomore in a ok cllg in ai branch with some what knowledge in python and java with 23 okish projects,"['Artificial Intelligence', 'Java', 'Python']",Java,Intern,Unknown
python internship,Should i even start applying for internships? ( am a upcoming Sophomore in a ok cllg in AI branch with some what knowledge in python and java with 2-3 okish projects ),r/internships,2026-05-01T07:41:57+00:00,https://old.reddit.com/r/internships/comments/1t0mmke/should_i_even_start_applying_for_internships_am_a/,2026-07-01,2.0,reddit,should i even start applying for internships am a upcoming sophomore in a ok cllg in ai branch with some what knowledge in python and java with 23 okish projects,"['Artificial Intelligence', 'Java', 'Python']",Python,Intern,Unknown
python internship,"I have no C++ or Python experience, why did I receive an interview from Citadel (internship)?",r/csMajors,2025-10-17T15:50:12+00:00,https://old.reddit.com/r/csMajors/comments/1o94ztf/i_have_no_c_or_python_experience_why_did_i/,2026-07-01,2.0,reddit,i have no c or python experience why did i receive an interview from citadel internship,"['C', 'Python']",C,Intern,Unknown
python internship,"I have no C++ or Python experience, why did I receive an interview from Citadel (internship)?",r/csMajors,2025-10-17T15:50:12+00:00,https://old.reddit.com/r/csMajors/comments/1o94ztf/i_have_no_c_or_python_experience_why_did_i/,2026-07-01,2.0,reddit,i have no c or python experience why did i receive an interview from citadel internship,"['C', 'Python']",Python,Intern,Unknown
python internship,is this enough to get an python internship ??,r/PythonLearning,2026-06-30T18:54:21+00:00,https://old.reddit.com/r/PythonLearning/comments/1ujy1o2/is_this_enough_to_get_an_python_internship/,2026-07-01,2.0,reddit,is this enough to get an python internship,['Python'],Python,Intern,Unknown
python internship,3rd Year Student. Need advice on Resume to get internship callbacks (Kotlin + Python),r/developersIndia,2026-03-28T10:33:06+00:00,https://old.reddit.com/r/developersIndia/comments/1s5wvb7/3rd_year_student_need_advice_on_resume_to_get/,2026-07-01,2.0,reddit,3rd year student need advice on resume to get internship callbacks kotlin python,['Python'],Python,Intern,Unknown
python internship,"Wasting 1st year successfully so far, mere resume ki shakal kaisi hai? Enough for internships if I do BI and python? Seniors?",r/Bansal_bhopal,2026-06-06T16:31:42+00:00,https://old.reddit.com/r/Bansal_bhopal/comments/1tylve7/wasting_1st_year_successfully_so_far_mere_resume/,2026-07-01,2.0,reddit,wasting 1st year successfully so far mere resume ki shakal kaisi hai enough for internships if i do bi and python seniors,"['Artificial Intelligence', 'Python']",Artificial Intelligence,Intern,Unknown
python internship,"Wasting 1st year successfully so far, mere resume ki shakal kaisi hai? Enough for internships if I do BI and python? Seniors?",r/Bansal_bhopal,2026-06-06T16:31:42+00:00,https://old.reddit.com/r/Bansal_bhopal/comments/1tylve7/wasting_1st_year_successfully_so_far_mere_resume/,2026-07-01,2.0,reddit,wasting 1st year successfully so far mere resume ki shakal kaisi hai enough for internships if i do bi and python seniors,"['Artificial Intelligence', 'Python']",Python,Intern,Unknown
python internship,"Title: 23.M, MCA (Tier-3). Stuck in an unpaid, WFH PHP internship. Should I stay for 6 months, switch to Python, or move to Bangalore?",r/phpjobs,2026-06-30T15:43:09+00:00,https://old.reddit.com/r/phpjobs/comments/1ujsrvi/title_23m_mca_tier3_stuck_in_an_unpaid_wfh_php/,2026-07-01,2.0,reddit,title 23m mca tier3 stuck in an unpaid wfh php internship should i stay for 6 months switch to python or move to bangalore,"['Artificial Intelligence', 'Python']",Artificial Intelligence,Intern,"Bangalore, Remote"
python internship,"Title: 23.M, MCA (Tier-3). Stuck in an unpaid, WFH PHP internship. Should I stay for 6 months, switch to Python, or move to Bangalore?",r/phpjobs,2026-06-30T15:43:09+00:00,https://old.reddit.com/r/phpjobs/comments/1ujsrvi/title_23m_mca_tier3_stuck_in_an_unpaid_wfh_php/,2026-07-01,2.0,reddit,title 23m mca tier3 stuck in an unpaid wfh php internship should i stay for 6 months switch to python or move to bangalore,"['Artificial Intelligence', 'Python']",Python,Intern,"Bangalore, Remote"
python internship,"2nd year student aiming for SC/Ops internships – rate my summer upskilling plan (Python, SQL, SAP, Green Belt)",r/supplychain,2026-05-04T09:05:15+00:00,https://old.reddit.com/r/supplychain/comments/1t3c9cg/2nd_year_student_aiming_for_scops_internships/,2026-07-01,2.0,reddit,2nd year student aiming for scops internships rate my summer upskilling plan python sql sap green belt,"['Artificial Intelligence', 'Python', 'SQL']",Artificial Intelligence,Intern,Unknown
python internship,"2nd year student aiming for SC/Ops internships – rate my summer upskilling plan (Python, SQL, SAP, Green Belt)",r/supplychain,2026-05-04T09:05:15+00:00,https://old.reddit.com/r/supplychain/comments/1t3c9cg/2nd_year_student_aiming_for_scops_internships/,2026-07-01,2.0,reddit,2nd year student aiming for scops internships rate my summer upskilling plan python sql sap green belt,"['Artificial Intelligence', 'Python', 'SQL']",Python,Intern,Unknown
python internship,"2nd year student aiming for SC/Ops internships – rate my summer upskilling plan (Python, SQL, SAP, Green Belt)",r/supplychain,2026-05-04T09:05:15+00:00,https://old.reddit.com/r/supplychain/comments/1t3c9cg/2nd_year_student_aiming_for_scops_internships/,2026-07-01,2.0,reddit,2nd year student aiming for scops internships rate my summer upskilling plan python sql sap green belt,"['Artificial Intelligence', 'Python', 'SQL']",SQL,Intern,Unknown
urgent hiring,"Urgently looking for any legitimate Work From Home (WFH) job. Open to anything, need to start ASAP",r/remotejobsfinders,2026-06-03T04:07:56+00:00,https://old.reddit.com/r/remotejobsfinders/comments/1tve8ww/urgently_looking_for_any_legitimate_work_from/,2026-07-01,2.0,reddit,urgently looking for any legitimate work from home wfh job open to anything need to start asap,['Git'],Git,Unknown,Remote
urgent hiring,"In the trailer for Spider-man: Brand New Day, we see a broke Spidey using a phone with an average cost of $1,099.99. This is a sign that the MCU urgently needs to hire poverty consultants",r/shittymoviedetails,2026-03-21T02:55:39+00:00,https://old.reddit.com/r/shittymoviedetails/comments/1rzgez8/in_the_trailer_for_spiderman_brand_new_day_we_see/,2026-07-01,2.0,reddit,in the trailer for spiderman brand new day we see a broke spidey using a phone with an average cost of 109999 this is a sign that the mcu urgently needs to hire poverty consultants,['Artificial Intelligence'],Artificial Intelligence,Unknown,Unknown
urgent hiring,"I would like to know who hired that brainless designer to make a horizontal menu, change that urgently.",r/ModernWarfareII,2022-10-28T07:02:33+00:00,https://old.reddit.com/r/ModernWarfareII/comments/yfh0wh/i_would_like_to_know_who_hired_that_brainless/,2026-07-01,2.0,reddit,i would like to know who hired that brainless designer to make a horizontal menu change that urgently,['Artificial Intelligence'],Artificial Intelligence,Unknown,Unknown
urgent hiring,Got married 6 months ago and we still get official looking “urgent” letters from lawyers telling us to hire them or we both risk being deported. I was born and raised in Michigan and my wife has been a full fledged us citizen for 10 years…,r/assholedesign,2022-04-10T13:03:33+00:00,https://old.reddit.com/r/assholedesign/comments/u0h5za/got_married_6_months_ago_and_we_still_get/,2026-07-01,2.0,reddit,got married 6 months ago and we still get official looking urgent letters from lawyers telling us to hire them or we both risk being deported i was born and raised in michigan and my wife has been a full fledged us citizen for 10 years,['Artificial Intelligence'],Artificial Intelligence,Unknown,Unknown
