keyword,title,subreddit,timestamp,post_url,scrape_date,batch_number,source,clean_title,skills_list,skill,role,location
developersindia layoffs,"Rock and a hard place. Bosch FTE or Big 3 AI apprentice, what do I do",r/developersIndia,2026-05-27T06:18:24+00:00,https://old.reddit.com/r/developersIndia/comments/1tox0d0/rock_and_a_hard_place_bosch_fte_or_big_3_ai/,,,,rock and a hard place bosch fte or big 3 ai apprentice what do i do,['Artificial Intelligence'],Artificial Intelligence,Unknown,Unknown
developersindia layoffs,"Laid Off, Stuck & Unsure What to Do Next | Need suggestion",r/developersIndia,2026-06-09T09:25:15+00:00,https://old.reddit.com/r/developersIndia/comments/1u1012p/laid_off_stuck_unsure_what_to_do_next_need/,,,,laid off stuck unsure what to do next need suggestion,['Artificial Intelligence'],Artificial Intelligence,Unknown,Unknown
developersindia layoffs,What are your plans and expectations for the upcoming appraisal season,r/developersIndia,2026-02-20T13:29:42+00:00,https://old.reddit.com/r/developersIndia/comments/1r9vdtf/what_are_your_plans_and_expectations_for_the/,,,,what are your plans and expectations for the upcoming appraisal season,['Artificial Intelligence'],Artificial Intelligence,Unknown,Unknown
developersindia layoffs,Stuck after switching to new company and may get laid off.,r/developersIndia,2026-02-05T09:42:27+00:00,https://old.reddit.com/r/developersIndia/comments/1qwh0k2/stuck_after_switching_to_new_company_and_may_get/,,,,stuck after switching to new company and may get laid off,['Artificial Intelligence'],Artificial Intelligence,Unknown,Unknown
software engineer bangalore,Bengaluru software engineer loses whopping Rs 11.8 crore to ‘digital arrest’ scam | Bangalore News - The Indian Express,r/bangalore,2024-12-23T12:59:45+00:00,https://old.reddit.com/r/bangalore/comments/1hkn8io/bengaluru_software_engineer_loses_whopping_rs_118/,,,,bengaluru software engineer loses whopping rs 118 crore to digital arrest scam bangalore news the indian express,['Git'],Git,Software Engineer,Bangalore
software engineer bangalore,"[0 YoE, Unemployed, Software Engineer / AI Engineer, India]",r/resumes,2025-12-19T05:25:54+00:00,https://old.reddit.com/r/resumes/comments/1pqd01s/0_yoe_unemployed_software_engineer_ai_engineer/,,,,0 yoe unemployed software engineer ai engineer india,['Artificial Intelligence'],Artificial Intelligence,Software Engineer,Unknown
software engineer bangalore,Hiring Junior Software Engineer Python Bangalore or Remote,r/Indiajobs,2026-06-05T09:45:02+00:00,https://old.reddit.com/r/Indiajobs/comments/1txg891/hiring_junior_software_engineer_python_bangalore/,,,,hiring junior software engineer python bangalore or remote,['Python'],Python,Software Engineer,"Bangalore, Remote"
data analyst hyderabad,Looking for genuine data analytics training in Hyderabad-not just marketing hype,r/hyderabad,2025-11-08T13:53:49+00:00,https://old.reddit.com/r/hyderabad/comments/1orpz7q/looking_for_genuine_data_analytics_training_in/,,,,looking for genuine data analytics training in hyderabadnot just marketing hype,['Artificial Intelligence'],Artificial Intelligence,Unknown,Hyderabad
data analyst hyderabad,Data/ Backend engineer: Hyderabad vs Navi mumbai offer,r/developersIndia,2026-02-08T06:19:26+00:00,https://old.reddit.com/r/developersIndia/comments/1qz1g2k/data_backend_engineer_hyderabad_vs_navi_mumbai/,,,,data backend engineer hyderabad vs navi mumbai offer,['Artificial Intelligence'],Artificial Intelligence,Backend Developer,"Hyderabad, Mumbai"
data analyst hyderabad,Fresher BTech graduate looking for entry-level roles in Hyderabad (Data Analyst / KAM / AI Prompt Engineer),r/hyderabad,2026-05-26T23:12:33+00:00,https://old.reddit.com/r/hyderabad/comments/1tonlld/fresher_btech_graduate_looking_for_entrylevel/,,,,fresher btech graduate looking for entrylevel roles in hyderabad data analyst kam ai prompt engineer,['Artificial Intelligence'],Artificial Intelligence,Data Analyst,Hyderabad
AI jobs india,India job market is cooked… what jobs are AI-proof?? 💀,r/AskIndia,2026-04-27T19:05:19+00:00,https://old.reddit.com/r/AskIndia/comments/1sxdax5/india_job_market_is_cooked_what_jobs_are_aiproof/,,,,india job market is cooked what jobs are aiproof,['Artificial Intelligence'],Artificial Intelligence,Unknown,Unknown
AI jobs india,AI its impact on Indian Job Market,r/AI_India,2026-06-07T07:28:07+00:00,https://old.reddit.com/r/AI_India/comments/1tz5hnv/ai_its_impact_on_indian_job_market/,,,,ai its impact on indian job market,['Artificial Intelligence'],Artificial Intelligence,Unknown,Unknown
AI jobs india,Is their anyone Who's working on full-time remote job in AI/Gen AI roles? Remote jobs from US or EU or Australia or Canada,r/AI_India,2026-06-17T12:45:36+00:00,https://old.reddit.com/r/AI_India/comments/1u8972g/is_their_anyone_whos_working_on_fulltime_remote/,,,,is their anyone whos working on fulltime remote job in aigen ai roles remote jobs from us or eu or australia or canada,['Artificial Intelligence'],Artificial Intelligence,Unknown,Remote
AI jobs india,Is AI going to wipe out entry-level IT jobs in India faster than analyst roles? Should freshers still enter IT at all?,r/AskIndia,2026-02-13T14:00:49+00:00,https://old.reddit.com/r/AskIndia/comments/1r3pwuo/is_ai_going_to_wipe_out_entrylevel_it_jobs_in/,,,,is ai going to wipe out entrylevel it jobs in india faster than analyst roles should freshers still enter it at all,['Artificial Intelligence'],Artificial Intelligence,Unknown,Unknown
AI jobs india,AI Training Side Hustle in India: Earn $16–$27/hour Depending on the Project and Qualifications,r/IndiaSideHustle,2026-06-15T01:59:17+00:00,https://old.reddit.com/r/IndiaSideHustle/comments/1u63ayz/ai_training_side_hustle_in_india_earn_1627hour/,,,,ai training side hustle in india earn 1627hour depending on the project and qualifications,['Artificial Intelligence'],Artificial Intelligence,Unknown,Unknown
AI jobs india,Moving from AI training into a proper career job,r/AiTraining_Annotation,2026-06-19T12:51:58+00:00,https://old.reddit.com/r/AiTraining_Annotation/comments/1ua16pe/moving_from_ai_training_into_a_proper_career_job/,,,,moving from ai training into a proper career job,['Artificial Intelligence'],Artificial Intelligence,Unknown,Unknown
AI jobs india,[Hiring] AI Engineer (Junior/Fresher) – Internship to Full-Time (Remote - INDIA),r/IndiaJobsOpenings,2026-04-22T23:30:23+00:00,https://old.reddit.com/r/IndiaJobsOpenings/comments/1st1xq3/hiring_ai_engineer_juniorfresher_internship_to/,,,,hiring ai engineer juniorfresher internship to fulltime remote india,['Artificial Intelligence'],Artificial Intelligence,AI Engineer,Remote
AI jobs india,I hosted the Head of IIT Delhi’s AI Lab yesterday. His reality check on India's AI scene was brutal.,r/Btechtards,2026-05-30T06:36:40+00:00,https://old.reddit.com/r/Btechtards/comments/1trs5yo/i_hosted_the_head_of_iit_delhis_ai_lab_yesterday/,,,,i hosted the head of iit delhis ai lab yesterday his reality check on indias ai scene was brutal,['Artificial Intelligence'],Artificial Intelligence,Unknown,Delhi
AI jobs india,I quit my job to build an AI SaaS. It flopped. The “boring” backup idea is now making me more in a month than I used to make in a year.,r/SaaS,2026-05-02T11:24:48+00:00,https://old.reddit.com/r/SaaS/comments/1t1n913/i_quit_my_job_to_build_an_ai_saas_it_flopped_the/,,,,i quit my job to build an ai saas it flopped the boring backup idea is now making me more in a month than i used to make in a year,['Artificial Intelligence'],Artificial Intelligence,Unknown,Unknown
AI jobs india,India isn’t losing the AI race. It never even entered it.,r/StartUpIndia,2026-05-12T05:54:40+00:00,https://old.reddit.com/r/StartUpIndia/comments/1tasjyp/india_isnt_losing_the_ai_race_it_never_even/,,,,india isnt losing the ai race it never even entered it,['Artificial Intelligence'],Artificial Intelligence,Unknown,Unknown
AI jobs india,India’s workers are training AI robots to take their jobs,r/technology,2026-06-13T16:03:43+00:00,https://old.reddit.com/r/technology/comments/1u4upsh/indias_workers_are_training_ai_robots_to_take/,,,,indias workers are training ai robots to take their jobs,['Artificial Intelligence'],Artificial Intelligence,Unknown,Unknown
AI jobs india,"This Scammer Used an AI-Generated MAGA Girl to Grift ‘Super Dumb’ Men. “Every day I’d write something pro-Christian, pro-Second Amendment, ... anti-abortion, anti-woke, and anti-immigration. In India, even in professional jobs, you can't make this amount of money.”",r/skeptic,2026-04-21T18:40:58+00:00,https://old.reddit.com/r/skeptic/comments/1srwp99/this_scammer_used_an_aigenerated_maga_girl_to/,,,,this scammer used an aigenerated maga girl to grift super dumb men every day id write something prochristian prosecond amendment antiabortion antiwoke and antiimmigration in india even in professional jobs you cant make this amount of money,['Artificial Intelligence'],Artificial Intelligence,Unknown,Unknown
AI jobs india,"The jobs aren’t being replaced by AI, but India",r/jobs,2023-10-09T18:29:34+00:00,https://old.reddit.com/r/jobs/comments/173z5jv/the_jobs_arent_being_replaced_by_ai_but_india/,,,,the jobs arent being replaced by ai but india,['Artificial Intelligence'],Artificial Intelligence,Unknown,Unknown
AI jobs india,India’s workers are training AI robots to take their jobs,r/Futurology,2026-06-14T04:54:46+00:00,https://old.reddit.com/r/Futurology/comments/1u5bw6d/indias_workers_are_training_ai_robots_to_take/,,,,indias workers are training ai robots to take their jobs,['Artificial Intelligence'],Artificial Intelligence,Unknown,Unknown
AI jobs india,Are all data science jobs just Gen AI now?,r/datascience,2026-06-21T06:22:58+00:00,https://old.reddit.com/r/datascience/comments/1ubilfx/are_all_data_science_jobs_just_gen_ai_now/,,,,are all data science jobs just gen ai now,"['Artificial Intelligence', 'Data Science']",Artificial Intelligence,Unknown,Unknown
AI jobs india,Are all data science jobs just Gen AI now?,r/datascience,2026-06-21T06:22:58+00:00,https://old.reddit.com/r/datascience/comments/1ubilfx/are_all_data_science_jobs_just_gen_ai_now/,,,,are all data science jobs just gen ai now,"['Artificial Intelligence', 'Data Science']",Data Science,Unknown,Unknown
AI jobs india,I believe the real AI job losses will be in India,r/sysadmin,2023-01-30T18:11:36+00:00,https://old.reddit.com/r/sysadmin/comments/10p9l0k/i_believe_the_real_ai_job_losses_will_be_in_india/,,,,i believe the real ai job losses will be in india,['Artificial Intelligence'],Artificial Intelligence,Unknown,Unknown
AI jobs india,From 3.6 LPA to 20L/month at 23: My Journey from Northeast India to OpenAI Project.,r/IndiaCareers,2025-08-30T12:02:55+00:00,https://old.reddit.com/r/IndiaCareers/comments/1n3zvy2/from_36_lpa_to_20lmonth_at_23_my_journey_from/,,,,from 36 lpa to 20lmonth at 23 my journey from northeast india to openai project,['Artificial Intelligence'],Artificial Intelligence,Unknown,Unknown
fresher jobs india,"Deloitte NLA shortlisting mails are out. Most freshers got rejected, this job market is brutal.",r/PlacementsPrep,2026-02-02T14:47:21+00:00,https://old.reddit.com/r/PlacementsPrep/comments/1qtwzkg/deloitte_nla_shortlisting_mails_are_out_most/,,,,deloitte nla shortlisting mails are out most freshers got rejected this job market is brutal,['Artificial Intelligence'],Artificial Intelligence,Unknown,Unknown
fresher jobs india,Are there any jobs in India for AI at all? Feeling lost.,r/developersIndia,2025-01-31T10:37:05+00:00,https://old.reddit.com/r/developersIndia/comments/1iebz3n/are_there_any_jobs_in_india_for_ai_at_all_feeling/,,,,are there any jobs in india for ai at all feeling lost,['Artificial Intelligence'],Artificial Intelligence,Unknown,Unknown
fresher jobs india,Mumbai Hiring : Non-Tech Jobs for B.Com/BA/BBA Freshers | 0-3 Years Exp Welcome,r/MumbaiJobsOpenings,2026-06-11T18:19:04+00:00,https://old.reddit.com/r/MumbaiJobsOpenings/comments/1u36ycl/mumbai_hiring_nontech_jobs_for_bcombabba_freshers/,,,,mumbai hiring nontech jobs for bcombabba freshers 03 years exp welcome,['Artificial Intelligence'],Artificial Intelligence,Unknown,Mumbai
ML engineer india,"Hiring: Machine Learning Engineer (India, Remote – Contract)",r/IndiaJobsOpenings,2026-01-14T01:45:30+00:00,https://old.reddit.com/r/IndiaJobsOpenings/comments/1qca8lw/hiring_machine_learning_engineer_india_remote/,,,,hiring machine learning engineer india remote contract,['Machine Learning'],Machine Learning,Machine Learning Engineer,Remote
ML engineer india,How can i earn extra as an ml engineer other than my job,r/developersIndia,2026-05-03T12:08:31+00:00,https://old.reddit.com/r/developersIndia/comments/1t2jp2r/how_can_i_earn_extra_as_an_ml_engineer_other_than/,,,,how can i earn extra as an ml engineer other than my job,['Machine Learning'],Machine Learning,Machine Learning Engineer,Unknown
ML engineer india,MacBook vs Windows for AI/ML Engineer (India) — Long-term laptop advice needed,r/developersIndia,2026-04-23T15:50:16+00:00,https://old.reddit.com/r/developersIndia/comments/1stmnhx/macbook_vs_windows_for_aiml_engineer_india/,,,,macbook vs windows for aiml engineer india longterm laptop advice needed,"['Artificial Intelligence', 'Machine Learning']",Artificial Intelligence,Machine Learning Engineer,Unknown
ML engineer india,MacBook vs Windows for AI/ML Engineer (India) — Long-term laptop advice needed,r/developersIndia,2026-04-23T15:50:16+00:00,https://old.reddit.com/r/developersIndia/comments/1stmnhx/macbook_vs_windows_for_aiml_engineer_india/,,,,macbook vs windows for aiml engineer india longterm laptop advice needed,"['Artificial Intelligence', 'Machine Learning']",Machine Learning,Machine Learning Engineer,Unknown
ML engineer india,Is ML ENGINEER really a right carrer choice for me rn,r/MachineLearningJobs,2026-05-27T07:20:11+00:00,https://old.reddit.com/r/MachineLearningJobs/comments/1toy5tw/is_ml_engineer_really_a_right_carrer_choice_for/,,,,is ml engineer really a right carrer choice for me rn,['Machine Learning'],Machine Learning,Machine Learning Engineer,Unknown
ML engineer india,My Experience Navigating the Dubai Job Market as an AI/ML Engineer,r/DubaiJobs,2026-02-23T09:01:01+00:00,https://old.reddit.com/r/DubaiJobs/comments/1rcci1j/my_experience_navigating_the_dubai_job_market_as/,,,,my experience navigating the dubai job market as an aiml engineer,"['Artificial Intelligence', 'Machine Learning']",Artificial Intelligence,Machine Learning Engineer,Unknown
ML engineer india,My Experience Navigating the Dubai Job Market as an AI/ML Engineer,r/DubaiJobs,2026-02-23T09:01:01+00:00,https://old.reddit.com/r/DubaiJobs/comments/1rcci1j/my_experience_navigating_the_dubai_job_market_as/,,,,my experience navigating the dubai job market as an aiml engineer,"['Artificial Intelligence', 'Machine Learning']",Machine Learning,Machine Learning Engineer,Unknown
ML engineer india,Cleared all Google interviews — waiting for team match (AI/ML role - india). Any suggestions to speed it up?,r/leetcode,2025-10-21T03:13:07+00:00,https://old.reddit.com/r/leetcode/comments/1oc23k1/cleared_all_google_interviews_waiting_for_team/,,,,cleared all google interviews waiting for team match aiml role india any suggestions to speed it up,"['Artificial Intelligence', 'Machine Learning']",Artificial Intelligence,Unknown,Unknown
ML engineer india,Cleared all Google interviews — waiting for team match (AI/ML role - india). Any suggestions to speed it up?,r/leetcode,2025-10-21T03:13:07+00:00,https://old.reddit.com/r/leetcode/comments/1oc23k1/cleared_all_google_interviews_waiting_for_team/,,,,cleared all google interviews waiting for team match aiml role india any suggestions to speed it up,"['Artificial Intelligence', 'Machine Learning']",Machine Learning,Unknown,Unknown
ML engineer india,"[1 year, 2025 Graduate, AI Engineer, India]",r/resumes,2026-03-29T10:45:55+00:00,https://old.reddit.com/r/resumes/comments/1s6ruf5/1_year_2025_graduate_ai_engineer_india/,,,,1 year 2025 graduate ai engineer india,['Artificial Intelligence'],Artificial Intelligence,AI Engineer,Unknown
ML engineer india,[Hiring] Relanto | AI/ML Roles (India & USA),r/MLjobs,2026-06-27T06:46:44+00:00,https://old.reddit.com/r/MLjobs/comments/1ugvglq/hiring_relanto_aiml_roles_india_usa/,,,,hiring relanto aiml roles india usa,"['Artificial Intelligence', 'Machine Learning']",Artificial Intelligence,Unknown,Unknown
ML engineer india,[Hiring] Relanto | AI/ML Roles (India & USA),r/MLjobs,2026-06-27T06:46:44+00:00,https://old.reddit.com/r/MLjobs/comments/1ugvglq/hiring_relanto_aiml_roles_india_usa/,,,,hiring relanto aiml roles india usa,"['Artificial Intelligence', 'Machine Learning']",Machine Learning,Unknown,Unknown
ML engineer india,[Hiring] Relanto | AI/ML Roles ( India & USA ),r/hireaideveloper,2026-06-28T19:48:16+00:00,https://old.reddit.com/r/hireaideveloper/comments/1ui6tzd/hiring_relanto_aiml_roles_india_usa/,,,,hiring relanto aiml roles india usa,"['Artificial Intelligence', 'Machine Learning']",Artificial Intelligence,Unknown,Unknown
ML engineer india,[Hiring] Relanto | AI/ML Roles ( India & USA ),r/hireaideveloper,2026-06-28T19:48:16+00:00,https://old.reddit.com/r/hireaideveloper/comments/1ui6tzd/hiring_relanto_aiml_roles_india_usa/,,,,hiring relanto aiml roles india usa,"['Artificial Intelligence', 'Machine Learning']",Machine Learning,Unknown,Unknown
ML engineer india,"[0 Years, Oracle Intern, Software Engineer, India] Not Getting Shortlisted Despite Internship",r/resumes,2026-06-23T11:19:28+00:00,https://old.reddit.com/r/resumes/comments/1udecav/0_years_oracle_intern_software_engineer_india_not/,,,,0 years oracle intern software engineer india not getting shortlisted despite internship,['SQL'],SQL,Software Engineer,Unknown
ML engineer india,"ML Engineer (5 YoE) considering MSc Business Analytics (University of Galway, Ireland). does it make sense?",r/Indians_StudyAbroad,2026-06-21T09:49:20+00:00,https://old.reddit.com/r/Indians_StudyAbroad/comments/1ublzyi/ml_engineer_5_yoe_considering_msc_business/,,,,ml engineer 5 yoe considering msc business analytics university of galway ireland does it make sense,['Machine Learning'],Machine Learning,Machine Learning Engineer,Unknown
ML engineer india,"[ 3 YoE, Unemployed, ML Engineer, India]",r/resumes,2026-06-15T16:14:28+00:00,https://old.reddit.com/r/resumes/comments/1u6l4jd/3_yoe_unemployed_ml_engineer_india/,,,,3 yoe unemployed ml engineer india,['Machine Learning'],Machine Learning,Machine Learning Engineer,Unknown
ML engineer india,[Hiring] Relanto | AI/ML Roles (India & USA),r/MachineLearningJobs,2026-06-27T06:46:30+00:00,https://old.reddit.com/r/MachineLearningJobs/comments/1ugvgft/hiring_relanto_aiml_roles_india_usa/,,,,hiring relanto aiml roles india usa,"['Artificial Intelligence', 'Machine Learning']",Artificial Intelligence,Unknown,Unknown
ML engineer india,[Hiring] Relanto | AI/ML Roles (India & USA),r/MachineLearningJobs,2026-06-27T06:46:30+00:00,https://old.reddit.com/r/MachineLearningJobs/comments/1ugvgft/hiring_relanto_aiml_roles_india_usa/,,,,hiring relanto aiml roles india usa,"['Artificial Intelligence', 'Machine Learning']",Machine Learning,Unknown,Unknown
ML engineer india,[Hiring] Relanto | Al/ML Roles (India & USA),r/MLjobs,2026-06-29T13:22:17+00:00,https://old.reddit.com/r/MLjobs/comments/1uisdty/hiring_relanto_alml_roles_india_usa/,,,,hiring relanto alml roles india usa,['Machine Learning'],Machine Learning,Unknown,Unknown
ML engineer india,"CV Review - ML Engineer (3 Months in, No leads)",r/learnmachinelearning,2026-01-26T14:22:25+00:00,https://old.reddit.com/r/learnmachinelearning/comments/1qnhc8r/cv_review_ml_engineer_3_months_in_no_leads/,,,,cv review ml engineer 3 months in no leads,['Machine Learning'],Machine Learning,Machine Learning Engineer,Unknown
ML engineer india,[Hiring] Relanto | AI/ML Roles (India & USA),r/MachineLearningJobs,2026-06-28T19:49:33+00:00,https://old.reddit.com/r/MachineLearningJobs/comments/1ui6v44/hiring_relanto_aiml_roles_india_usa/,,,,hiring relanto aiml roles india usa,"['Artificial Intelligence', 'Machine Learning']",Artificial Intelligence,Unknown,Unknown
ML engineer india,[Hiring] Relanto | AI/ML Roles (India & USA),r/MachineLearningJobs,2026-06-28T19:49:33+00:00,https://old.reddit.com/r/MachineLearningJobs/comments/1ui6v44/hiring_relanto_aiml_roles_india_usa/,,,,hiring relanto aiml roles india usa,"['Artificial Intelligence', 'Machine Learning']",Machine Learning,Unknown,Unknown
ML engineer india,Is it a good move - back to India to an early stage startup (ML role)?,r/developersIndia,2026-02-21T03:27:12+00:00,https://old.reddit.com/r/developersIndia/comments/1ragfep/is_it_a_good_move_back_to_india_to_an_early_stage/,,,,is it a good move back to india to an early stage startup ml role,['Machine Learning'],Machine Learning,Unknown,Unknown
ML engineer india,ML Engineer with ~6 YOE | Seeking Career Advice on Joining vs Waiting for an International Opportunity,r/developersIndia,2026-06-24T08:18:05+00:00,https://old.reddit.com/r/developersIndia/comments/1ue7if7/ml_engineer_with_6_yoe_seeking_career_advice_on/,,,,ml engineer with 6 yoe seeking career advice on joining vs waiting for an international opportunity,"['Artificial Intelligence', 'Machine Learning']",Artificial Intelligence,Machine Learning Engineer,Unknown
ML engineer india,ML Engineer with ~6 YOE | Seeking Career Advice on Joining vs Waiting for an International Opportunity,r/developersIndia,2026-06-24T08:18:05+00:00,https://old.reddit.com/r/developersIndia/comments/1ue7if7/ml_engineer_with_6_yoe_seeking_career_advice_on/,,,,ml engineer with 6 yoe seeking career advice on joining vs waiting for an international opportunity,"['Artificial Intelligence', 'Machine Learning']",Machine Learning,Machine Learning Engineer,Unknown
ML engineer india,Laptop recommendation for heavy ML/DL + local LLM work as a Computer Engineering student (India) — Budget ₹1.2L / ~$1400,r/deeplearning,2026-05-10T09:35:36+00:00,https://old.reddit.com/r/deeplearning/comments/1t92cdn/laptop_recommendation_for_heavy_mldl_local_llm/,,,,laptop recommendation for heavy mldl local llm work as a computer engineering student india budget 12l 1400,"['Artificial Intelligence', 'Machine Learning']",Artificial Intelligence,Unknown,Unknown
ML engineer india,Laptop recommendation for heavy ML/DL + local LLM work as a Computer Engineering student (India) — Budget ₹1.2L / ~$1400,r/deeplearning,2026-05-10T09:35:36+00:00,https://old.reddit.com/r/deeplearning/comments/1t92cdn/laptop_recommendation_for_heavy_mldl_local_llm/,,,,laptop recommendation for heavy mldl local llm work as a computer engineering student india budget 12l 1400,"['Artificial Intelligence', 'Machine Learning']",Machine Learning,Unknown,Unknown
hiring india,Boeing Is Hiring 20 Times More Engineers From India As US Aims To Cut Dependence On China: Media,r/wallstreetbets,2024-08-21T21:56:53+00:00,https://old.reddit.com/r/wallstreetbets/comments/1ey28xe/boeing_is_hiring_20_times_more_engineers_from/,,,,boeing is hiring 20 times more engineers from india as us aims to cut dependence on china media,['Artificial Intelligence'],Artificial Intelligence,Unknown,Unknown
hiring india,"""Boeing Is Hiring 20 Times More Engineers From India As US Aims To Cut Dependence On China""",r/WorkReform,2024-08-22T17:43:54+00:00,https://old.reddit.com/r/WorkReform/comments/1eypo5k/boeing_is_hiring_20_times_more_engineers_from/,,,,boeing is hiring 20 times more engineers from india as us aims to cut dependence on china,['Artificial Intelligence'],Artificial Intelligence,Unknown,Unknown
hiring india,"Israel seeks collab with India Inc, startups; aims to hire Indian workers",r/IndiaSpeaks,2024-12-05T03:10:39+00:00,https://old.reddit.com/r/IndiaSpeaks/comments/1h6zbuq/israel_seeks_collab_with_india_inc_startups_aims/,,,,israel seeks collab with india inc startups aims to hire indian workers,['Artificial Intelligence'],Artificial Intelligence,Unknown,Unknown
software developer india,Hiring: Full-Stack Software Developer (Node.js / React / AI Applications),r/DeveloperJobs,2026-06-16T14:44:19+00:00,https://old.reddit.com/r/DeveloperJobs/comments/1u7fjy6/hiring_fullstack_software_developer_nodejs_react/,2026-07-01,1.0,reddit,hiring fullstack software developer nodejs react ai applications,"['Artificial Intelligence', 'JavaScript']",Artificial Intelligence,Software Engineer,Unknown
software developer india,Hiring: Full-Stack Software Developer (Node.js / React / AI Applications),r/DeveloperJobs,2026-06-16T14:44:19+00:00,https://old.reddit.com/r/DeveloperJobs/comments/1u7fjy6/hiring_fullstack_software_developer_nodejs_react/,2026-07-01,1.0,reddit,hiring fullstack software developer nodejs react ai applications,"['Artificial Intelligence', 'JavaScript']",JavaScript,Software Engineer,Unknown
software developer india,India vs Dubai for Software Developer,r/UAE,2026-06-13T05:59:32+00:00,https://old.reddit.com/r/UAE/comments/1u4iwr8/india_vs_dubai_for_software_developer/,2026-07-01,1.0,reddit,india vs dubai for software developer,['Artificial Intelligence'],Artificial Intelligence,Software Engineer,Unknown
backend developer india,"WTF, Node.js has no jobs? I AM Nodejs Backend Developer",r/developersIndia,2025-03-06T13:35:59+00:00,https://old.reddit.com/r/developersIndia/comments/1j4vl5e/wtf_nodejs_has_no_jobs_i_am_nodejs_backend/,2026-07-01,1.0,reddit,wtf nodejs has no jobs i am nodejs backend developer,['JavaScript'],JavaScript,Software Engineer,Unknown
backend developer india,Looking for an experienced React + Node.js freelance developer (India),r/WebDeveloperJobs,2026-03-08T10:20:32+00:00,https://old.reddit.com/r/WebDeveloperJobs/comments/1ro1e2o/looking_for_an_experienced_react_nodejs_freelance/,2026-07-01,1.0,reddit,looking for an experienced react nodejs freelance developer india,['JavaScript'],JavaScript,Software Engineer,Unknown
